,stStation,Quantity,Acquisition Value,city_name,deaths
8100,NJ: ASBURY PARK POLICE DEPARTMENT,0.0,0.0,NJ: Asbury Park,1.0
8101,AL: RANBURNE POLICE DEPARTMENT,0.0,0.0,AL: Ranburne,1.0
8102,NJ: PEMBERTON BOROUGH POLICE DEPARTMENT,0.0,0.0,NJ: Pemberton,1.0
8103,OK: OKLAHOMA HIGHWAY PATROL,0.0,0.0,OK: McAlester,1.0
8141,FL: WEST PALM BEACH POLICE DEPARTMENT,0.0,0.0,FL: West Palm Beach,3.0
8144,PA: PENN HILLS POLICE DEPARTMENT,0.0,0.0,PA: Penn Hills,2.0
8146,FL: HOLLYWOOD POLICE DEPARTMENT,0.0,0.0,FL: Hollywood,5.0
8151,NJ: NEWARK POLICE DEPARTMENT,0.0,0.0,NJ: Oak Ridge,10.0
8161,NJ: ORANGE POLICE DEPARTMENT,0.0,0.0,NJ: City of Orange,1.0
8162,OH: BROOKLYN POLICE DEPARTMENT,0.0,0.0,OH: Cleveland,1.0
8164,IL: CHICAGO POLICE DEPARTMENT,0.0,0.0,IL: Chicago,76.0
8240,NM: TULAROSA POLICE DEPARTMENT,0.0,0.0,NM: Tularosa,2.0
8242,FL: PENSACOLA POLICE DEPARTMENT,0.0,0.0,FL: Pensacola,2.0
8244,CA: FULLERTON POLICE DEPARTMENT,0.0,0.0,CA: Anaheim,3.0
8247,GA: ROSWELL POLICE DEPARTMENT,0.0,0.0,GA: Roswell,2.0
8249,CA: CHINO POLICE DEPARTMENT,0.0,0.0,CA: Chino,2.0
8251,IA: WEST DES MOINES POLICE DEPARTMENT,0.0,0.0,IA: West Des Moines,1.0
8252,WA: POULSBO POLICE DEPARTMENT,0.0,0.0,WA: Poulsbo,1.0
8253,OH: ELYRIA POLICE DEPARTMENT,0.0,0.0,OH: Elyria,1.0
8254,MN: EAGAN POLICE DEPARTMENT,0.0,0.0,MN: Eagan,2.0
8256,FL: PORT ST. LUCIE POLICE DEPARTMENT,0.0,0.0,FL: Port St. Lucie,2.0
8258,NC: NORTH CAROLINA STATE HIGHWAY PATROL,0.0,0.0,NC: Clayton,2.0
8270,MS: PEARL POLICE DEPARTMENT,0.0,0.0,MS: Pearl,2.0
8272,FL: SPRINGFIELD POLICE DEPARTMENT,0.0,0.0,FL: Springfield,2.0
8274,OH: SUGARCREEK POLICE DEPARTMENT,0.0,0.0,OH: Sugarcreek,1.0
8275,VA: TIMBERVILLE POLICE DEPARTMENT,0.0,0.0,VA: Timberville,1.0
8276,FL: MIAMI POLICE DEPARTMENT,0.0,0.0,FL: Miami,1.0
8294,CA: CALIFORNIA DEPARTMENT OF PARKS AND RECREATION,0.0,0.0,CA: Big Sur,1.0
8295,TX: U.S. FEDERAL PROTECTIVE SERVICE,0.0,0.0,TX: Dallas,1.0
8296,WI: MOUNT PLEASANT POLICE DEPARTMENT,0.0,0.0,WI: Mt. Pleasant,1.0
8297,AK: ALASKA STATE TROOPERS,0.0,0.0,AK: Fairbanks,1.0
8327,NH: NEW HAMPSHIRE STATE POLICE,0.0,0.0,NH: Belmont,1.0
8335,MO: ST. LOUIS COUNTY POLICE DEPARTMENT,0.0,0.0,MO: Florissant,1.0
8359,MD: MONTGOMERY COUNTY DEPARTMENT OF POLICE,0.0,0.0,MD: Rockville,1.0
8360,TN: U.S. MARSHALS SERVICE,0.0,0.0,TN: Memphis,1.0
8368,CA: SAN LEANDRO POLICE DEPARTMENT,0.0,0.0,CA: San Leandro,2.0
8370,OK: LAWTON POLICE DEPARTMENT,0.0,0.0,OK: Lawton,4.0
8374,NM: U.S. FEDERAL BUREAU OF INVESTIGATION,0.0,0.0,NM: Albuquerque,1.0
8375,AR: JONESBORO POLICE DEPARTMENT,0.0,0.0,AR: Jonesboro,5.0
8380,NM: BERNALILLO POLICE DEPARTMENT,0.0,0.0,NM: Bernalillo,2.0
8382,MI: WAYNE STATE UNIVERSITY POLICE DEPARTMENT,0.0,0.0,MI: Detroit,1.0
8383,NY: U.S. FEDERAL BUREAU OF INVESTIGATION,0.0,0.0,NY: Ardsley,1.0
8384,CA: U.S. CUSTOMS AND BORDER PROTECTION,0.0,0.0,CA: San Diego,2.0
8386,TN: COLLIERVILLE POLICE DEPARTMENT,0.0,0.0,TN: Collierville,1.0
8387,LA: SHREVEPORT POLICE DEPARTMENT,0.0,0.0,LA: Shreveport,9.0
8396,MO: MISSOURI STATE HIGHWAY PATROL,0.0,0.0,MO: Winston,2.0
8410,WA: AUBURN POLICE DEPARTMENT,0.0,0.0,WA: Auburn,3.0
8413,CA: ONTARIO POLICE DEPARTMENT,0.0,0.0,CA: Ontario,6.0
8419,AL: HUNTSVILLE POLICE DEPARTMENT,0.0,0.0,AL: Huntsville,10.0
8429,TX: AMARILLO POLICE DEPARTMENT,0.0,0.0,TX: Amarillo,10.0
8439,NC: WILMINGTON POLICE DEPARTMENT,0.0,0.0,NC: Wilmington,4.0
8443,KS: WICHITA POLICE DEPARTMENT,0.0,0.0,KS: Wichita,12.0
8455,WI: U.S. MARSHALS SERVICE,0.0,0.0,WI: Ashland,1.0
8456,ME: MAINE STATE POLICE,0.0,0.0,ME: Auburn,4.0
8460,OK: BLACKWELL POLICE DEPARTMENT,0.0,0.0,OK: Blackwell,1.0
8461,MS: OXFORD POLICE DEPARTMENT,0.0,0.0,MS: Oxford,1.0
8462,CA: HURON POLICE DEPARTMENT,0.0,0.0,CA: Huron,2.0
8464,AZ: NAVAJO POLICE DEPARTMENT,0.0,0.0,AZ: Tonalea,1.0
8465,TX: NEW BOSTON POLICE DEPARTMENT,0.0,0.0,TX: New Boston,1.0
8466,FL: DAVIE POLICE DEPARTMENT,0.0,0.0,FL: Davie,1.0
8467,TX: BAYTOWN POLICE DEPARTMENT,0.0,0.0,TX: Baytown,2.0
8469,VT: VERMONT STATE POLICE,0.0,0.0,VT: Tunbridge,2.0
8471,GA: SAVANNAH POLICE DEPARTMENT,0.0,0.0,GA: Savannah,1.0
8475,GA: COLUMBUS GA POLICE DEPARTMENT,0.0,0.0,GA: Columbus,5.0
8480,CA: MONTEBELLO POLICE DEPARTMENT,0.0,0.0,CA: Montebello,4.0
8484,VA: VIRGINIA STATE POLICE,0.0,0.0,VA: Wytheville,3.0
8500,WA: SEATTLE POLICE DEPARTMENT,0.0,0.0,WA: Seattle,23.0
8523,CA: SANTA BARBARA POLICE DEPARTMENT,0.0,0.0,CA: Santa Barbara,1.0
8524,MS: LUMBERTON POLICE DEPARTMENT,0.0,0.0,MS: Lumberton,1.0
8525,NM: ANGEL FIRE POLICE DEPARTMENT,0.0,0.0,NM: Angel Fire,1.0
8526,CA: STOCKTON POLICE DEPARTMENT,0.0,0.0,CA: Stockton,1.0
8560,OK: EDMOND POLICE DEPARTMENT,0.0,0.0,OK: Edmond,2.0
8562,NC: APEX POLICE DEPARTMENT,0.0,0.0,NC: Apex,1.0
8563,NC: RALEIGH POLICE DEPARTMENT,0.0,0.0,NC: Raleigh,4.0
8567,CA: FREMONT POLICE DEPARTMENT,0.0,0.0,CA: Fremont,7.0
8574,AZ: U.S. DEPARTMENT OF HOMELAND SECURITY,0.0,0.0,AZ: Phoenix,1.0
8575,CA: INDIO POLICE DEPARTMENT,0.0,0.0,CA: Indio,7.0
8582,FL: MEXICO BEACH POLICE DEPARTMENT,0.0,0.0,FL: Mexico Beach,1.0
8583,AR: BLYTHEVILLE POLICE DEPARTMENT,0.0,0.0,AR: Blytheville,2.0
8585,NM: U.S. CUSTOMS AND BORDER PROTECTION,0.0,0.0,NM: Santa Teresa,2.0
8587,IL: BLOOMINGDALE POLICE DEPARTMENT,0.0,0.0,IL: Glendale Heights,1.0
8588,IN: BROWNSTOWN POLICE DEPARTMENT,0.0,0.0,IN: Brownstown,1.0
8589,NC: DURHAM POLICE DEPARTMENT,0.0,0.0,NC: Durham,7.0
8596,TX: BURNET POLICE DEPARTMENT,0.0,0.0,TX: Burnet,1.0
8597,CA: INGLEWOOD POLICE DEPARTMENT,0.0,0.0,CA: Inglewood,6.0
8603,PA: STATE COLLEGE POLICE DEPARTMENT,0.0,0.0,PA: State College,1.0
8604,LA: BASTROP POLICE DEPARTMENT,0.0,0.0,LA: Bastrop,1.0
8605,MO: UNIVERSITY CITY POLICE DEPARTMENT,0.0,0.0,MO: University City,1.0
8606,OR: THE DALLES POLICE DEPARTMENT,0.0,0.0,OR: The Dalles,1.0
8607,IL: ILLINOIS STATE POLICE,0.0,0.0,IL: Glen Carbon,2.0
8615,OK: SALLISAW POLICE DEPARTMENT,0.0,0.0,OK: Sallisaw,2.0
8617,NJ: TRENTON POLICE DEPARTMENT,0.0,0.0,NJ: Trenton,6.0
8623,PA: GREENSBURG POLICE DEPARTMENT,0.0,0.0,PA: Greensburg,2.0
8625,NE: GRAND ISLAND POLICE DEPARTMENT,0.0,0.0,NE: Grand Island,1.0
8626,FL: FLORIDA HIGHWAY PATROL,0.0,0.0,FL: Miami,6.0
8632,MI: KALAMAZOO PUBLIC SAFETY,0.0,0.0,MI: Kalamazoo,1.0
8633,CA: SAN BERNARDINO POLICE DEPARTMENT,0.0,0.0,CA: San Bernardino,10.0
8643,MD: MARYLAND STATE POLICE,0.0,0.0,MD: Westminster,13.0
8656,VT: BURLINGTON POLICE DEPARTMENT,0.0,0.0,VT: Burlington,3.0
8659,NC: HERTFORD COUNTY CHIEF DEPUTY WILL LIVERMAN,0.0,0.0,NC: Cofield,1.0
8660,WV: U.S. MARSHALS SERVICE,0.0,0.0,WV: Morgantown,3.0
8663,MO: U.S. MARSHALS SERVICE,0.0,0.0,MO: Springfield,1.0
8667,IA: DES MOINES POLICE DEPARTMENT,0.0,0.0,IA: Des Moines,7.0
8674,NC: MOUNT HOLLY POLICE DEPARTMENT,0.0,0.0,NC: Mount Holly,1.0
8675,TX: WACO POLICE DEPARTMENT,0.0,0.0,TX: Waco,5.0
8680,HI: HAWAII DEPARTMENT OF PUBLIC SAFETY,0.0,0.0,HI: Honolulu,1.0
8684,TX: FAIRFIELD POLICE DEPARTMENT,0.0,0.0,TX: Fairfield,1.0
8685,CO: LONE TREE POLICE DEPARTMENT,0.0,0.0,CO: Littleton,1.0
8686,TX: KILLEEN POLICE DEPARTMENT,0.0,0.0,TX: Killeen,3.0
8689,OH: U.S. FEDERAL BUREAU OF INVESTIGATION,0.0,0.0,OH: Struthers,1.0
8690,GA: GEORGIA STATE PATROL,0.0,0.0,GA: Townsend,1.0
8706,TN: CLARKSVILLE POLICE DEPARTMENT,0.0,0.0,TN: Clarksville,2.0
8708,MS: MEMPHIS POLICE DEPARTMENT,0.0,0.0,MS: Horn Lake,1.0
8709,GA: U.S. IMMIGRATION AND CUSTOMS ENFORCEMENT,0.0,0.0,GA: Lithia Springs,1.0
8710,TN: TENNESSEE HIGHWAY PATROL,0.0,0.0,TN: Tazewell,1.0
8714,IL: AURORA POLICE DEPARTMENT,0.0,0.0,IL: Aurora,2.0
8716,MS: JACKSON POLICE DEPARTMENT,0.0,0.0,MS: Jackson,6.0
8722,TX: U.S. NAVY SECURITY FORCES,0.0,0.0,TX: Corpus Christi,1.0
8723,NC: U.S. FEDERAL BUREAU OF INVESTIGATION,0.0,0.0,NC: Apex,1.0
8724,OH: DEFIANCE POLICE DEPARTMENT,0.0,0.0,OH: Defiance,1.0
8725,CA: MADERA POLICE DEPARTMENT,0.0,0.0,CA: Madera,2.0
8727,TX: SNYDER POLICE DEPARTMENT,0.0,0.0,TX: Snyder,1.0
8728,CA: BANNING POLICE DEPARTMENT,0.0,0.0,CA: Banning,2.0
8730,CO: LA SALLE POLICE DEPARTMENT,0.0,0.0,CO: La Salle,2.0
8732,WV: CLARKSBURG POLICE DEPARTMENT,0.0,0.0,WV: Clarksburg,1.0
8733,GA: GWINNETT COUNTY POLICE DEPARTMENT,0.0,0.0,GA: Buford,8.0
8741,MI: JACKSON POLICE DEPARTMENT,0.0,0.0,MI: Jackson,2.0
8743,SD: ROSEBUD SIOUX TRIBAL POLICE DEPARTMENT,0.0,0.0,SD: Rosebud,2.0
8745,NM: NAVAJO POLICE DEPARTMENT,0.0,0.0,NM: Naschitti,2.0
8747,NV: NORTH LAS VEGAS POLICE DEPARTMENT,0.0,0.0,NV: North Las Vegas,7.0
8754,MT: BILLINGS POLICE DEPARTMENT,0.0,0.0,MT: Billings,1.0
8774,WA: RICHLAND POLICE DEPARTMENT,0.0,0.0,WA: Richland,1.0
8775,MN: ST. LOUIS PARK POLICE DEPARTMENT,0.0,0.0,MN: St. Louis Park,2.0
8777,SD: U.S. MARSHALS SERVICE,0.0,0.0,SD: White Lake,2.0
8779,TX: HUNTSVILLE POLICE DEPARTMENT,0.0,0.0,TX: Huntsville,1.0
8780,GA: CLARKSTON POLICE DEPARTMENT,0.0,0.0,GA: Decatur,1.0
8781,WA: KENT POLICE DEPARTMENT,0.0,0.0,WA: Kent,6.0
8787,CA: SANTA CLARA POLICE DEPARTMENT,0.0,0.0,CA: Santa Clara,4.0
8791,MT: BOZEMAN POLICE DEPARTMENT,0.0,0.0,MT: Bozeman,1.0
8792,MN: ALBERT LEA POLICE DEPARTMENT,0.0,0.0,MN: Albert Lea,1.0
8793,CA: VISALIA POLICE DEPARTMENT,0.0,0.0,CA: Visalia,7.0
8800,GA: PINE LAKE POLICE DEPARTMENT,0.0,0.0,GA: Stone Mountain,1.0
8801,MO: ST. JOSEPH POLICE DEPARTMENT,0.0,0.0,MO: St. Joseph,4.0
8805,TN: TULLAHOMA POLICE DEPARTMENT,0.0,0.0,TN: Tullahoma,1.0
8806,AR: RECTOR POLICE DEPARTMENT,0.0,0.0,AR: Rector,1.0
8807,HI: MAUI POLICE DEPARTMENT,0.0,0.0,HI: Wailuku,2.0
8809,OH: TOLEDO POLICE DEPARTMENT,0.0,0.0,OH: Toledo,7.0
8816,VA: HOPEWELL POLICE DEPARTMENT,0.0,0.0,VA: Hopewell,3.0
8819,WA: YAKIMA POLICE DEPARTMENT,0.0,0.0,WA: Yakima,1.0
8831,CA: UPLAND POLICE DEPARTMENT,0.0,0.0,CA: Upland,1.0
8832,HI: HAWAII COUNTY POLICE DEPARTMENT,0.0,0.0,HI: Phoa,2.0
8834,GA: U.S. MARSHALS SERVICE,0.0,0.0,GA: Lizella,3.0
8837,NY: BUFFALO POLICE DEPARTMENT,0.0,0.0,NY: Buffalo,3.0
8840,NY: FREDONIA POLICE DEPARTMENT,0.0,0.0,NY: Fredonia,1.0
8841,CA: TORRANCE POLICE DEPARTMENT,0.0,0.0,CA: Torrance,5.0
8846,IL: PALATINE POLICE DEPARTMENT,0.0,0.0,IL: Palatine,1.0
8847,GA: HENRY COUNTY POLICE DEPARTMENT,0.0,0.0,GA: Mcdonough,5.0
8852,VA: RICHMOND POLICE DEPARTMENT,0.0,0.0,VA: Richmond,6.0
8858,PA: PHILADELPHIA POLICE DEPARTMENT,0.0,0.0,PA: Philadelphia,32.0
8890,CA: ARVIN POLICE DEPARTMENT,0.0,0.0,CA: Arvin,1.0
8891,ME: OLD TOWN POLICE DEPARTMENT,0.0,0.0,ME: Old Town,1.0
8892,CA: U.S. BORDER PATROL,0.0,0.0,CA: Boulevard,8.0
8900,KS: KANSAS HIGHWAY PATROL,0.0,0.0,KS: Topeka,1.0
8906,HI: HAWAII POLICE DEPARTMENT,0.0,0.0,HI: Pahoa,9.0
8915,MS: NEW ALBANY POLICE DEPARTMENT,0.0,0.0,MS: New Albany,2.0
8917,UT: SOUTH SALT LAKE POLICE DEPARTMENT,0.0,0.0,UT: Salt Lake City,2.0
8919,CO: COLORADO STATE PATROL,0.0,0.0,CO: Crested Butte,4.0
8923,MN: STILLWATER POLICE DEPARTMENT,0.0,0.0,MN: Stillwater,1.0
8924,AZ: U.S. MARSHALS SERVICE,0.0,0.0,AZ: Phoenix,3.0
8927,ID: IDAHO STATE POLICE,0.0,0.0,ID: Meridian,1.0
8933,SC: SPARTANBURG POLICE DEPARTMENT,0.0,0.0,SC: Spartanburg,2.0
8935,OK: WAGONER POLICE DEPARTMENT,0.0,0.0,OK: Wagoner,2.0
8937,IL: MIDLOTHIAN POLICE DEPARTMENT,0.0,0.0,IL: Robbins,1.0
8938,MS: CLARKSDALE POLICE DEPARTMENT,0.0,0.0,MS: Clarksdale,1.0
8939,MN: SHAKOPEE POLICE DEPARTMENT,0.0,0.0,MN: Shakopee,1.0
8940,TX: SAN ANTONIO PARK POLICE DEPARTMENT,0.0,0.0,TX: San Antonio,2.0
8942,MI: ST. CLAIR SHORES POLICE DEPARTMENT,0.0,0.0,MI: St. Clair Shores,1.0
8943,CA: PITTSBURG POLICE DEPARTMENT,0.0,0.0,CA: Pittsburg,3.0
8946,UT: UNIFIED POLICE DEPARTMENT OF GREATER SALT LAKE,0.0,0.0,UT: Riverton,2.0
8952,NC: WASHINGTON POLICE DEPARTMENT,0.0,0.0,NC: Washington,1.0
8953,TX: PARIS POLICE DEPARTMENT,0.0,0.0,TX: Paris,1.0
8954,MA: BROCKTON POLICE DEPARTMENT,0.0,0.0,MA: Brockton,2.0
8956,CO: ARVADA POLICE DEPARTMENT,0.0,0.0,CO: Wheat Ridge,4.0
8960,WA: PUYALLUP TRIBAL POLICE DEPARTMENT,0.0,0.0,WA: Tacoma,1.0
8961,FL: FLORIDA STATE FIRE MARSHALS,0.0,0.0,FL: Panama City,1.0
8962,UT: OREM POLICE DEPARTMENT,0.0,0.0,UT: Orem,1.0
8963,AZ: U.S. NATIONAL PARK SERVICE,0.0,0.0,AZ: Chinle,1.0
8964,AZ: CHANDLER POLICE DEPARTMENT,0.0,0.0,AZ: Chandler,3.0
8967,CA: HUNTINGTON BEACH POLICE DEPARTMENT,0.0,0.0,CA: Huntington Beach,6.0
8973,UT: WEST JORDAN POLICE DEPARTMENT,0.0,0.0,UT: West Jordan,4.0
8977,MS: GREENVILLE POLICE DEPARTMENT,0.0,0.0,MS: Greenville,4.0
8981,TN: MT. PLEASANT POLICE DEPARTMENT,0.0,0.0,TN: Memphis,1.0
8982,MN: HASTINGS POLICE DEPARTMENT,0.0,0.0,MN: Hastings,1.0
8983,LA: LOUISIANA STATE POLICE,0.0,0.0,LA: Hammond,3.0
8993,WA: KENNEWICK POLICE DEPARTMENT,0.0,0.0,WA: Kennewick,3.0
8996,NJ: EAST ORANGE POLICE DEPARTMENT,0.0,0.0,NJ: Newark,2.0
8998,AZ: PEORIA POLICE DEPARTMENT,0.0,0.0,AZ: Peoria,1.0
8999,OR: EAGLE POINT POLICE DEPARTMENT,0.0,0.0,OR: Eagle Point,1.0
9000,WA: MARYSVILLE POLICE DEPARTMENT,0.0,0.0,WA: Marysville,1.0
9001,PA: LANCASTER POLICE DEPARTMENT,0.0,0.0,PA: Lancaster,4.0
9005,WI: MANITOWOC POLICE DEPARTMENT,0.0,0.0,WI: Manitowoc,1.0
9006,TX: U.S. CUSTOMS AND BORDER PATROL,0.0,0.0,TX: Laredo,4.0
9010,IL: VERNON HILLS POLICE DEPARTMENT,0.0,0.0,IL: Vernon Hills,1.0
9011,MD: GREENSBORO MD POLICE DEPARTMENT,0.0,0.0,MD: Greensboro,1.0
9012,IA: ANKENY POLICE DEPARTMENT,0.0,0.0,IA: Ankeny,2.0
9014,TX: LAREDO POLICE DEPARTMENT,0.0,0.0,TX: Laredo,8.0
9022,TX: MISSOURI CITY POLICE DEPARTMENT,0.0,0.0,TX: Missouri City,1.0
9023,RI: PAWTUCKET POLICE DEPARTMENT,0.0,0.0,RI: Pawtucket,3.0
9026,OH: CINCINNATI POLICE DEPARTMENT,0.0,0.0,OH: Cincinnati,12.0
9038,AL: ALABAMA DEPARTMENT OF PUBLIC SAFETY,0.0,0.0,AL: Morris,1.0
9040,WA: CHENEY POLICE DEPARTMENT,0.0,0.0,WA: Cheney,1.0
9041,GA: COVINGTON POLICE DEPARTMENT,0.0,0.0,GA: Covington,1.0
9042,CA: SOUTH PASADENA POLICE DEPARTMENT,0.0,0.0,CA: South Pasadena,2.0
9044,NC: TARBORO POLICE DEPARTMENT,0.0,0.0,NC: Tarboro,2.0
9046,OH: PERRYSBURG TOWNSHIP POLICE DEPARTMENT,0.0,0.0,OH: Perrysburg,1.0
9047,NC: U.S. IMMIGRATION AND CUSTOMS ENFORCEMENT,0.0,0.0,NC: Charlotte,1.0
9048,WA: SHORELINE POLICE DEPARTMENT,0.0,0.0,WA: Shoreline,1.0
9049,NH: ROCHESTER NH POLICE DEPARTMENT,0.0,0.0,NH: Rochester,1.0
9050,CA: CULVER CITY POLICE DEPARTMENT,0.0,0.0,CA: Culver City,2.0
9052,CA: CERES POLICE DEPARTMENT,0.0,0.0,CA: Denair,4.0
9056,TX: MIDLAND POLICE DEPARTMENT,0.0,0.0,TX: Midland,6.0
9062,AK: WASILLA POLICE DEPARTMENT,0.0,0.0,AK: Wasilla,2.0
9064,IA: CRESTON POLICE DEPARTMENT,0.0,0.0,IA: Creston,1.0
9065,AR: TRUMANN POLICE DEPARTMENT,0.0,0.0,AR: Trumann,1.0
9066,AR: PINE BLUFF POLICE DEPARTMENT,0.0,0.0,AR: Pine Bluff,3.0
9069,FL: SUNRISE POLICE DEPARTMENT,0.0,0.0,FL: Sunrise,3.0
9072,IA: OTTUMWA POLICE DEPARTMENT,0.0,0.0,IA: Ottumwa,1.0
9073,LA: SHREVEPORT CITY MARSHAL,0.0,0.0,LA: Shreveport,1.0
9074,CA: PLEASANTON POLICE DEPARTMENT,0.0,0.0,CA: Pleasanton,3.0
9077,LA: BALL POLICE DEPARTMENT,0.0,0.0,LA: Pineville,1.0
9078,PA: SOUTH WHITEHALL TOWNSHIP POLICE DEPARTMENT,0.0,0.0,PA: Allentown,1.0
9079,TX: PILOT POINT POLICE DEPARTMENT,0.0,0.0,TX: Pilot Point,1.0
9080,CA: REDONDO BEACH POLICE DEPARTMENT,0.0,0.0,CA: Redondo Beach,3.0
9083,TN: RED BANK POLICE DEPARTMENT,0.0,0.0,TN: Soddy Daisy,1.0
9084,OR: SEASIDE POLICE DEPARTMENT,0.0,0.0,OR: Seaside,2.0
9086,NC: BURLINGTON POLICE DEPARTMENT,0.0,0.0,NC: Burlington,1.0
9087,VA: BRISTOL POLICE DEPARTMENT,0.0,0.0,VA: Bristol,1.0
9088,CA: UNIVERSITY OF CALIFORNIA - RIVERSIDE POLICE,0.0,0.0,CA: Riverside,1.0
9089,CA: RIVERSIDE POLICE DEPARTMENT,0.0,0.0,CA: Riverside,8.0
9097,NC: FLETCHER POLICE DEPARTMENT,0.0,0.0,NC: Fletcher,1.0
9098,NJ: VINELAND POLICE DEPARTMENT,0.0,0.0,NJ: Vineland,3.0
9101,TX: DILLEY POLICE DEPARTMENT,0.0,0.0,TX: Dilley,1.0
9102,CA: LOS BANOS POLICE DEPARTMENT,0.0,0.0,CA: Los Banos,3.0
9105,WY: CASPER POLICE DEPARTMENT,0.0,0.0,WY: Casper,5.0
9110,KS: OVERLAND PARK POLICE DEPARTMENT,0.0,0.0,KS: Overland Park,2.0
9112,ND: DEVILS LAKE POLICE DEPARTMENT,0.0,0.0,ND: Devils Lake,1.0
9113,MO: GRANDVIEW POLICE DEPARTMENT,0.0,0.0,MO: Grandview,1.0
9114,IA: PANORA POLICE DEPARTMENT,0.0,0.0,IA: Panora,1.0
9115,ID: MERIDIAN POLICE DEPARTMENT,0.0,0.0,ID: Boise,2.0
9117,OR: PORTLAND STATE UNIVERSITY DEPARTMENT OF PUBLIC SAFETY,0.0,0.0,OR: Portland,1.0
9118,MI: WATERFORD TOWNSHIP POLICE DEPARTMENT,0.0,0.0,MI: Waterford,1.0
9119,FL: SOUTH DAYTONA POLICE DEPARTMENT,0.0,0.0,FL: South Daytona,1.0
9121,GA: GLYNN COUNTY POLICE DEPARTMENT,0.0,0.0,GA: Darien,2.0
9123,LA: MONROE POLICE DEPARTMENT,0.0,0.0,LA: Monroe,1.0
9124,OH: FAIRFIELD POLICE DEPARTMENT,0.0,0.0,OH: Fairfield,1.0
9125,PA: EAST PITTSBURGH POLICE DEPARTMENT,0.0,0.0,PA: East Pittsburgh,1.0
9126,NY: WARWICK POLICE DEPARTMENT,0.0,0.0,NY: Warwick,1.0
9127,IL: NOKOMIS POLICE DEPARTMENT,0.0,0.0,IL: Nokomis,1.0
9128,WA: REDMOND POLICE DEPARTMENT,0.0,0.0,WA: Kirkland,1.0
9129,LA: CARENCRO POLICE DEPARTMENT,0.0,0.0,LA: Carencro,1.0
9130,IL: DANVILLE POLICE DEPARTMENT,0.0,0.0,IL: Danville,2.0
9132,NJ: NEW JERSEY STATE POLICE,0.0,0.0,NJ: Hardwick,6.0
9138,NM: U.S. MARSHALS SERVICE,0.0,0.0,NM: Albuquerque,4.0
9142,IN: U.S. BUREAU OF ALCOHOL TOBACCO FIREARMS AND EXPLOSIVES,0.0,0.0,IN: Gary,1.0
9143,IL: U.S. DRUG ENFORCEMENT ADMINISTRATION,0.0,0.0,IL: Chicago,1.0
9144,NC: SALISBURY POLICE DEPARTMENT,0.0,0.0,NC: Thomasville,3.0
9147,CA: ORANGE COVE POLICE DEPARTMENT,0.0,0.0,CA: Dinuba,1.0
9148,UT: COTTONWOOD HEIGHTS POLICE DEPARTMENT,0.0,0.0,UT: Cottonwood Heights,1.0
9149,CO: U.S. BUREAU OF LAND MANAGEMENT,0.0,0.0,CO: Grand Junction,1.0
9150,TX: DUMAS POLICE DEPARTMENT,0.0,0.0,TX: Dumas,1.0
9151,TX: LUBBOCK POLICE DEPARTMENT,0.0,0.0,TX: Lubbock,3.0
9154,TX: STAGECOACH POLICE DEPARTMENT,0.0,0.0,TX: Stagecoach,1.0
9155,WI: FOX CROSSING POLICE DEPARTMENT,0.0,0.0,WI: Neenah,1.0
9156,IL: GURNEE POLICE DEPARTMENT,0.0,0.0,IL: Gurnee,1.0
9157,TX: MATHIS POLICE DEPARTMENT,0.0,0.0,TX: Mathis,1.0
9158,OR: GRESHAM POLICE DEPARTMENT,0.0,0.0,OR: Gresham,2.0
9160,MI: LIVONIA POLICE DEPARTMENT,0.0,0.0,MI: Livonia,1.0
9161,VA: ROYAL OAK POLICE DEPARTMENT,0.0,0.0,VA: Richmond,1.0
9162,MI: ROYAL OAK POLICE DEPARTMENT,0.0,0.0,MI: Royal Oak,2.0
9164,ID: BLACKFOOT POLICE DEPARTMENT,0.0,0.0,ID: Blackfoot,1.0
9165,PA: LOWER BURRELL POLICE DEPARTMENT,0.0,0.0,PA: New Kensington,1.0
9166,PA: MANHEIM TOWNSHIP POLICE DEPARTMENT,0.0,0.0,PA: Lancaster,1.0
9167,AZ: U.S. IMMIGRATION AND CUSTOMS ENFORCEMENT,0.0,0.0,AZ: Mesa,2.0
9169,GA: COLLEGE PARK POLICE DEPARTMENT,0.0,0.0,GA: East Point,1.0
9170,AZ: SCOTTSDALE POLICE DEPARTMENT,0.0,0.0,AZ: Tempe,8.0
9178,OH: KETTERING POLICE DEPARTMENT,0.0,0.0,OH: Dayton,2.0
9180,SD: BOX ELDER POLICE DEPARTMENT,0.0,0.0,SD: Box Elder,1.0
9181,TX: U.S. IMMIGRATION AND CUSTOMS ENFORCEMENT,0.0,0.0,TX: San Antonio,1.0
9182,GA: JOHNS CREEK POLICE DEPARTMENT,0.0,0.0,GA: Johns Creek,1.0
9184,FL: CASSELBERRY POLICE DEPARTMENT,0.0,0.0,FL: Casselberry,1.0
9185,IA: BOONE POLICE DEPARTMENT,0.0,0.0,IA: Boone,1.0
9186,AZ: HUALAPAI NATION POLICE DEPARTMENT,0.0,0.0,AZ: Seligman,1.0
9187,FL: U.S. MARSHALS SERVICE,0.0,0.0,FL: Fort Lauderdale,2.0
9191,MT: U.S. BUREAU OF INDIAN AFFAIRS,0.0,0.0,MT: Lodge Grass,1.0
9192,NJ: WINSLOW TOWNSHIP POLICE DEPARTMENT,0.0,0.0,NJ: Millville,1.0
9193,CO: U.S. MARSHALS SERVICE,0.0,0.0,CO: Welby,1.0
9194,AR: HELENA-WEST HELENA POLICE DEPARTMENT,0.0,0.0,AR: West Helena,1.0
9195,TX: U.S. BORDER PATROL,0.0,0.0,TX: Laredo,7.0
9202,VA: DANVILLE POLICE DEPARTMENT,0.0,0.0,VA: Danville,2.0
9204,UT: WEST VALLEY POLICE DEPARTMENT,0.0,0.0,UT: West Valley City,1.0
9205,MD: U.S. PARK POLICE,0.0,0.0,MD: Indian Head,1.0
9206,NY: GREECE POLICE DEPARTMENT,0.0,0.0,NY: Rochester,2.0
9208,OK: OKMULGEE POLICE DEPARTMENT,0.0,0.0,OK: Okmulgee,2.0
9210,CA: PETALUMA POLICE DEPARTMENT,0.0,0.0,CA: Petaluma,1.0
9211,MO: BELTON POLICE DEPARTMENT,0.0,0.0,MO: Belton,1.0
9212,IL: U.S. DEPARTMENT OF HOUSING AND URBAN DEVELOPMENT,0.0,0.0,IL: Zion,1.0
9213,WV: SOUTH CHARLESTON POLICE DEPARTMENT,0.0,0.0,WV: Charleston,1.0
9214,OK: STILLWATER POLICE DEPARTMENT,0.0,0.0,OK: Stillwater,2.0
9216,AL: ALABAMA LAW ENFORCEMENT AGENCY,0.0,0.0,AL: Sylacauga,2.0
9218,AL: MONTGOMERY POLICE DEPARTMENT,0.0,0.0,AL: Montgomery,3.0
9221,TX: ABILENE POLICE DEPARTMENT,0.0,0.0,TX: Abilene,3.0
9224,TX: LITTLEFIELD POLICE DEPARTMENT,0.0,0.0,TX: Littlefield,1.0
9225,OK: MANNFORD POLICE DEPARTMENT,0.0,0.0,OK: Mannford,1.0
9226,TX: LANCASTER POLICE DEPARTMENT,0.0,0.0,TX: Lancaster,1.0
9227,AZ: CASA GRANDE POLICE DEPARTMENT,0.0,0.0,AZ: Casa Grande,2.0
9229,OR: KEIZER POLICE DEPARTMENT,0.0,0.0,OR: Keizer,1.0
9230,UT: U.S. BUREAU OF ALCOHOL TOBACCO FIREARMS AND EXPLOSIVES,0.0,0.0,UT: Sandy,1.0
9231,IL: ELGIN POLICE DEPARTMENT,0.0,0.0,IL: Elgin,1.0
9232,ND: WEST FARGO POLICE DEPARTMENT,0.0,0.0,ND: West Fargo,1.0
9233,MI: MIDLAND POLICE DEPARTMENT,0.0,0.0,MI: Midland,1.0
9234,CA: OAKLAND POLICE DEPARTMENT,0.0,0.0,CA: Oakland,9.0
9243,CA: FONTANA POLICE DEPARTMENT,0.0,0.0,CA: Fontana,1.0
9257,MO: CLINTON POLICE DEPARTMENT,0.0,0.0,MO: Clinton,1.0
9258,IN: NORTH MANCHESTER POLICE DEPARTMENT,0.0,0.0,IN: North Manchester,1.0
9259,ID: SANDPOINT POLICE DEPARTMENT,0.0,0.0,ID: Sandpoint,1.0
9261,PA: BRISTOL TOWNSHIP POLICE DEPARTMENT,0.0,0.0,PA: Levittown,1.0
9262,AZ: PIMA COUNTY ADULT PROBATION DEPARTMENT,0.0,0.0,AZ: Tucson,1.0
9263,KS: WAMEGO POLICE DEPARTMENT,0.0,0.0,KS: Wamego,1.0
9264,TX: STRATFORD POLICE DEPARTMENT,0.0,0.0,TX: Stratford,1.0
9265,MD: PHOENIX POLICE DEPARTMENT,0.0,0.0,MD: Fort Washington,1.0
9266,TX: DENTON POLICE DEPARTMENT,0.0,0.0,TX: Denton,1.0
9267,FL: COCOA BEACH POLICE DEPARTMENT,0.0,0.0,FL: Cocoa Beach,1.0
9268,NC: HENDERSON NC POLICE DEPARTMENT,0.0,0.0,NC: Henderson,2.0
9270,FL: U.S. CUSTOMS AND BORDER PROTECTION,0.0,0.0,FL: Homestead,1.0
9271,FL: TALLAHASSEE POLICE DEPARTMENT,0.0,0.0,FL: Tallahassee,1.0
9283,MA: READING POLICE DEPARTMENT,0.0,0.0,MA: Reading,1.0
9284,PA: HARRISBURG POLICE BUREAU,0.0,0.0,PA: Harrisburg,1.0
9285,IL: ROCK FALLS POLICE DEPARTMENT,0.0,0.0,IL: Rock Falls,1.0
9286,IL: U.S. MARSHALS SERVICE,0.0,0.0,IL: Alton,1.0
9287,GA: SAVANNAH-CHATHAM METROPOLITAN POLICE DEPARTMENT,0.0,0.0,GA: Savannah,3.0
9290,NY: ONEIDA POLICE DEPARTMENT,0.0,0.0,NY: Oneida,1.0
9291,TX: IRVING POLICE DEPARTMENT,0.0,0.0,TX: Irving,7.0
9298,MN: FAIRMONT POLICE DEPARTMENT,0.0,0.0,MN: Fairmont,1.0
9299,IN: BOONVILLE POLICE DEPARTMENT,0.0,0.0,IN: Boonville,1.0
9300,WI: RACINE POLICE DEPARTMENT,0.0,0.0,WI: Racine,1.0
9301,CA: DALY CITY POLICE DEPARTMENT,0.0,0.0,CA: Daly City,2.0
9303,NC: HUNTERSVILLE POLICE DEPARTMENT,0.0,0.0,NC: Huntersville,2.0
9305,PA: NORTHERN YORK COUNTY REGIONAL POLICE DEPARTMENT,0.0,0.0,PA: York,1.0
9309,AZ: U.S. FOREST SERVICE,0.0,0.0,AZ: Sedona,2.0
9311,OH: WHITEHALL POLICE DEPARTMENT,0.0,0.0,OH: Whitehall,1.0
9312,CA: BAY AREA RAPID TRANSIT POLICE DEPARTMENT,0.0,0.0,CA: Oakland,2.0
9314,FL: EDGEWATER POLICE DEPARTMENT,0.0,0.0,FL: Edgewater,2.0
9316,PA: NORTHERN YORK COUNTY REGIONAL POLICE,0.0,0.0,PA: Dover,2.0
9318,VA: CHESTERFIELD COUNTY POLICE DEPARTMENT,0.0,0.0,VA: Chester,1.0
9319,CA: DESERT HOT SPRINGS POLICE DEPARTMENT,0.0,0.0,CA: Desert Hot Springs,2.0
9321,TX: PROGRESO POLICE DEPARTMENT,0.0,0.0,TX: Weslaco,1.0
9322,PA: PENNSYLVANIA STATE CAPITOL POLICE,0.0,0.0,PA: Harrisburg,1.0
9323,OH: MIAMI TOWNSHIP POLICE DEPARTMENT,0.0,0.0,OH: Miamisburg,1.0
9324,AR: MULBERRY POLICE DEPARTMENT,0.0,0.0,AR: Mulberry,1.0
9325,TX: THE COLONY POLICE DEPARTMENT,0.0,0.0,TX: The Colony,1.0
9326,MI: OAK PARK POLICE DEPARTMENT,0.0,0.0,MI: Oak Park,1.0
9327,TN: MCMINNVILLE POLICE DEPARTMENT,0.0,0.0,TN: McMinnville,1.0
9328,WY: ARNOLD POLICE DEPARTMENT,0.0,0.0,WY: Cheyenne,1.0
9329,FL: CORAL SPRINGS POLICE DEPARTMENT,0.0,0.0,FL: Coral Springs,1.0
9330,CA: COLTON POLICE DEPARTMENT,0.0,0.0,CA: Colton,3.0
9333,TX: HAMLIN POLICE DEPARTMENT,0.0,0.0,TX: Hamlin,1.0
9334,NC: HENDERSONVILLE POLICE DEPARTMENT,0.0,0.0,NC: Hendersonville,1.0
9335,NY: GREENBURGH POLICE DEPARTMENT,0.0,0.0,NY: Hartsdale,1.0
9336,MO: CAMERON POLICE DEPARTMENT,0.0,0.0,MO: Cameron,1.0
9337,AZ: U.S. CUSTOMS AND BORDER PROTECTION,0.0,0.0,AZ: Sells,1.0
9338,CA: LOMPOC POLICE DEPARTMENT,0.0,0.0,CA: Lompoc,2.0
9340,IA: DAVENPORT POLICE DEPARTMENT,0.0,0.0,IA: Davenport,3.0
9343,VA: US PARK POLICE,0.0,0.0,VA: Fort Hunt,1.0
9344,MS: EDWARDS POLICE DEPARTMENT,0.0,0.0,MS: Edwards,1.0
9345,VA: ROANOKE CITY POLICE DEPARTMENT,0.0,0.0,VA: Roanoke,1.0
9346,OK: LINDSAY POLICE DEPARTMENT,0.0,0.0,OK: Lindsay,1.0
9347,VA: LYNCHBURG POLICE DEPARTMENT,0.0,0.0,VA: Lynchburg,1.0
9348,MS: MERIDIAN POLICE DEPARTMENT,0.0,0.0,MS: Meridian,2.0
9350,AR: CLARKSVILLE POLICE DEPARTMENT,0.0,0.0,AR: Clarksville,1.0
9351,MS: COLUMBUS MS POLICE DEPARTMENT,0.0,0.0,MS: Columbus,1.0
9352,CO: PARKER POLICE DEPARTMENT,0.0,0.0,CO: Parker,1.0
9353,AR: BATESVILLE POLICE DEPARTMENT,0.0,0.0,AR: Batesville,1.0
9354,FL: PORT ORANGE POLICE DEPARTMENT,0.0,0.0,FL: Port Orange,2.0
9356,CA: SUNNYVALE POLICE DEPARTMENT,0.0,0.0,CA: Sunnyvale,6.0
9362,PA: DAVENPORT POLICE DEPARTMENT,0.0,0.0,PA: King of Prussi,1.0
9363,MS: HERNANDO POLICE DEPARTMENT,0.0,0.0,MS: Senatobia,1.0
9364,IN: NEW CASTLE POLICE DEPARTMENT,0.0,0.0,IN: New Castle,2.0
9366,PA: ERIE POLICE DEPARTMENT,0.0,0.0,PA: Erie,2.0
9368,AL: FAIRHOPE POLICE DEPARTMENT,0.0,0.0,AL: Fairhope,1.0
9369,FL: ST. PETERSBURG POLICE DEPARTMENT,0.0,0.0,FL: St. Petersburg,10.0
9379,PA: PENNSYLVANIA FISH AND BOAT COMMISSION,0.0,0.0,PA: Nanticoke,1.0
9380,ND: BUREAU OF INDIAN AFFAIRS,0.0,0.0,ND: Fort Yates,1.0
9381,KY: SHELBYVILLE POLICE DEPARTMENT,0.0,0.0,KY: Shelbyville,1.0
9382,WI: CRANDON POLICE DEPARTMENT,0.0,0.0,WI: Crandon,1.0
9383,OH: GIRARD POLICE DEPARTMENT,0.0,0.0,OH: Girard,1.0
9384,CA: CLOVERDALE POLICE DEPARTMENT,0.0,0.0,CA: Cloverdale,1.0
9385,OH: MORAINE POLICE DEPARTMENT,0.0,0.0,OH: Moraine,1.0
9386,CA: ATWATER POLICE DEPARTMENT,0.0,0.0,CA: Atwater,2.0
9388,VA: CHARLOTTESVILLE POLICE DEPARTMENT,0.0,0.0,VA: Charlottesville,1.0
9389,CA: SAN FERNANDO POLICE DEPARTMENT,0.0,0.0,CA: San Fernando,3.0
9392,PA: PERRYOPOLIS POLICE DEPARTMENT,0.0,0.0,PA: Perryopolis,1.0
9393,NY: CANANDAIGUA POLICE DEPARTMENT,0.0,0.0,NY: Canandaigua,1.0
9394,AK: SEWARD POLICE DEPARTMENT,0.0,0.0,AK: Seward,1.0
9395,CO: FORT COLLINS POLICE SERVICES,0.0,0.0,CO: Fort Collins,1.0
9403,KS: TOPEKA POLICE DEPARTMENT,0.0,0.0,KS: Topeka,4.0
9407,FL: PALMETTO POLICE DEPARTMENT,0.0,0.0,FL: Palmetto,1.0
9408,CA: OCEANSIDE BEACH POLICE DEPARTMENT,0.0,0.0,CA: Oceanside,1.0
9409,TX: ROCKWALL POLICE DEPARTMENT,0.0,0.0,TX: Rockwall,1.0
