,stStation,Quantity,Acquisition Value,city_name,deaths
1,AK: ANCHORAGE POLICE DEPARTMENT,17536.0,899408.669999997,AK: Anchorage,13.0
14,AK: FAIRBANKS POLICE DEPARTMENT,1.0,689000.0,AK: Fairbanks,2.0
30,AL: ALEXANDER CITY POLICE DEPARTMENT,404.0,1051110.76,AL: Alexander City,1.0
33,AL: ANNISTON POLICE DEPARTMENT,20.0,341056.0,AL: Anniston,2.0
36,AL: ARAB POLICE DEPARTMENT,290.0,265289.05,AL: Arab,1.0
38,AL: ASHVILLE POLICE DEPARTMENT,38.0,129015.42000000001,AL: Ashville,1.0
41,AL: AUBURN POLICE DEPARTMENT,144.0,963004.69,AL: Notasulga,1.0
48,AL: BIRMINGHAM POLICE DEPARTMENT,118.0,525722.4899999998,AL: Birmingham,7.0
96,AL: DEMOPOLIS POLICE DEPARTMENT,65.0,12488.69,AL: Demopolis,1.0
108,AL: EUFAULA POLICE DEPARTMENT,20.0,335.0,AL: Eufaula,1.0
115,AL: GADSDEN POLICE DEPARTMENT,68.0,250996.26,AL: Gadsden,1.0
131,AL: HANCEVILLE POLICE DEPARTMENT,392.0,2052201.1599999995,AL: Hanceville,1.0
140,AL: HOMEWOOD POLICE DEPARTMENT,168.0,127587.89999999994,AL: Birmingham,4.0
144,AL: HOOVER POLICE DEPARTMENT,66.0,329310.0,AL: Birmingham,2.0
149,AL: IRONDALE POLICE DEPARTMENT,24.0,176468.33999999997,AL: Birmingham,1.0
152,AL: JACKSONVILLE POLICE DEPARTMENT,153.0,559243.34,AL: Jacksonville,2.0
163,AL: LEEDS POLICE DEPARTMENT,5.0,41503.0,AL: Leeds,1.0
169,AL: LOXLEY POLICE DEPARTMENT,1.0,50458.0,AL: Loxley,1.0
171,AL: MADISON POLICE DEPARTMENT,24.0,590029.0,AL: Madison,1.0
178,AL: MILLBROOK POLICE DEPARTMENT,62.0,290774.64,AL: Millbrook,1.0
180,AL: MOBILE POLICE DEPARTMENT,29.0,55033.0,AL: Mobile,5.0
199,AL: OXFORD POLICE DEPARTMENT,4587.0,2477004.1799999997,AL: Oxford,1.0
202,AL: PELL CITY POLICE DEPARTMENT,448.0,450058.1599999998,AL: Pell City,1.0
204,AL: PHENIX CITY POLICE DEPARTMENT,15.0,2070.0,AL: Phenix City,3.0
208,AL: PIEDMONT POLICE DEPARTMENT,17.0,88754.0,AL: Piedmont,1.0
212,AL: PRICEVILLE POLICE DEPARTMENT,1.0,41061.0,AL: Huntsville,1.0
213,AL: PRICHARD POLICE DEPARTMENT,4.0,188253.0,AL: Prichard,1.0
215,AL: RAINBOW CITY POLICE DEPARTMENT,58.0,127942.69,AL: Rainbow City,1.0
224,AL: SELMA POLICE DEPARTMENT,40.0,15557.099999999995,AL: Selma,4.0
240,AL: TALLADEGA POLICE DEPARTMENT,52.0,318528.69000000006,AL: Talladega,2.0
250,AL: TUSCALOOSA POLICE DEPARTMENT,838.0,5568990.14,AL: Tuscaloosa,1.0
251,AL: TUSCUMBIA POLICE DEPARTMENT,753.0,611750.2700000005,AL: Tuscumbia,1.0
260,AL: WARRIOR POLICE DEPARTMENT,1.0,41061.0,AL: Warrior,1.0
264,AL: WINFIELD POLICE DEPARTMENT,21.0,92788.0,AL: Winfield,1.0
275,AR: BENTON POLICE DEPARTMENT,498.0,1436018.53,AR: Benton,4.0
279,AR: BENTONVILLE POLICE DEPARTMENT,28.0,826442.0,AR: Bentonville,1.0
283,AR: BRYANT POLICE DEPARTMENT,1026.0,1378500.6099999992,AR: Bryant,2.0
302,AR: FORT SMITH POLICE DEPARTMENT,1.0,733000.0,AR: Fort Smith,1.0
323,AR: JACKSONVILLE POLICE DEPARTMENT,28.0,840099.0,AR: Jacksonville,4.0
332,AR: LITTLE ROCK POLICE DEPARTMENT,67.0,2500528.84,AR: Little Rock,12.0
347,AR: MANILA POLICE DEPARTMENT,4.0,357.42,AR: Manila,1.0
349,AR: MARION POLICE DEPARTMENT,26.0,10700.0,AR: Marion,1.0
360,AR: NORTH LITTLE ROCK POLICE DEPARTMENT,1013.0,1038586.7999999998,AR: North Little Rock,2.0
364,AR: OZARK POLICE DEPARTMENT,93.0,71486.29999999999,AR: Ozark,1.0
370,AR: POCAHONTAS POLICE DEPARTMENT,30.0,9223.94,AR: Pocahontas,1.0
387,AR: SPRINGDALE POLICE DEPARTMENT,2319.0,516204.3200000001,AR: Springdale,2.0
394,AR: VAN BUREN POLICE DEPARTMENT,65.0,934.1500000000001,AR: Van Buren,1.0
395,AR: WALNUT RIDGE POLICE DEPARTMENT,1.0,63894.0,AR: Walnut Ridge,1.0
398,AR: WEST MEMPHIS POLICE DEPARTMENT,2.0,127494.0,AR: West Memphis,4.0
404,AZ: APACHE JUNCTION POLICE DEPARTMENT,31.0,805351.0,AZ: Apache Junction,1.0
408,AZ: AVONDALE POLICE DEPARTMENT,115.0,713960.3700000001,AZ: Avondale,5.0
416,AZ: BISBEE POLICE DEPARTMENT,72.0,102228.66,AZ: Bisbee,1.0
417,AZ: BUCKEYE POLICE DEPARTMENT,86.0,961108.9500000001,AZ: Buckeye,5.0
422,AZ: BULLHEAD CITY POLICE DEPARTMENT,1.0,187988.0,AZ: Bullhead City,1.0
429,AZ: COTTONWOOD POLICE DEPARTMENT,70.0,999865.21,AZ: Cottonwood,2.0
431,AZ: DOUGLAS POLICE DEPARTMENT,1.0,412000.0,AZ: Tucson,1.0
432,AZ: EL MIRAGE POLICE DEPARTMENT,4.0,1558.0,AZ: Youngtown,1.0
434,AZ: FLAGSTAFF POLICE DEPARTMENT,21.0,43461.0,AZ: Flagstaff,4.0
441,AZ: GILBERT POLICE DEPARTMENT,844.0,144098.52,AZ: Gilbert,4.0
445,AZ: GLENDALE POLICE DEPARTMENT,1.0,7500.11,AZ: Glendale,1.0
471,AZ: KINGMAN POLICE DEPARTMENT,127.0,1421417.0299999998,AZ: Kingman,4.0
476,AZ: LAKE HAVASU CITY POLICE DEPARTMENT,300.0,25.990000000000002,AZ: Lake Havasu City,2.0
479,AZ: MARANA POLICE DEPARTMENT,438.0,74188.38,AZ: Marana,3.0
482,AZ: MESA POLICE DEPARTMENT,4538.0,1074599.7100000004,AZ: Mesa,2.0
537,AZ: PINETOP-LAKESIDE POLICE DEPARTMENT,56.0,240482.0,AZ: Lakeside,1.0
539,AZ: PRESCOTT POLICE DEPARTMENT,271.0,690301.32,AZ: Prescott,2.0
544,AZ: SAHUARITA POLICE DEPARTMENT,1.0,89900.0,AZ: Sahuarita,1.0
548,AZ: SAN LUIS POLICE DEPARTMENT,4.0,209362.0,AZ: Gadsden,1.0
551,AZ: SIERRA VISTA POLICE DEPARTMENT,4.0,188470.0,AZ: Sierra Vista,2.0
554,AZ: SOUTH TUCSON POLICE DEPARTMENT,15.0,19243.0,AZ: Tucson,2.0
557,AZ: SURPRISE POLICE DEPARTMENT,811.0,902816.0999999997,AZ: Surprise,3.0
560,AZ: TEMPE POLICE DEPARTMENT,4.0,744587.2,AZ: Tempe,10.0
573,AZ: TUCSON POLICE DEPARTMENT,352.0,951333.75,AZ: Tucson,28.0
603,AZ: WINSLOW POLICE DEPARTMENT,44.0,93839.87000000002,AZ: Winslow,1.0
606,AZ: YUMA POLICE DEPARTMENT,304.0,672374.07,AZ: Yuma,3.0
612,CA: ANAHEIM POLICE DEPARTMENT,6.0,12375.0,CA: Anaheim,13.0
625,CA: ANDERSON POLICE DEPARTMENT,40.0,670.0,CA: Anderson,3.0
628,CA: ANTIOCH POLICE DEPARTMENT,261.0,1787474.6500000001,CA: Antioch,5.0
636,CA: AZUSA POLICE DEPARTMENT,23.0,1230534.66,CA: Azusa,3.0
639,CA: BAKERSFIELD POLICE DEPARTMENT,2424.0,2058050.8699999996,CA: Bakersfield,24.0
663,CA: BARSTOW POLICE DEPARTMENT,1.0,733000.0,CA: Barstow,3.0
666,CA: BELL GARDENS POLICE DEPARTMENT,1089.0,698392.4299999998,CA: Bell Gardens,1.0
667,CA: BELL POLICE DEPARTMENT,4.0,77794.38,CA: Bell,1.0
681,CA: CATHEDRAL CITY POLICE DEPARTMENT,1.0,77000.0,CA: Cathedral City,4.0
687,CA: CHICO POLICE DEPARTMENT,115.0,117379.55,CA: Chico,3.0
690,CA: CITRUS HEIGHTS POLICE DEPARTMENT,109.0,740638.63,CA: Citrus Heights,7.0
698,CA: CLOVIS POLICE DEPARTMENT,1.0,658000.0,CA: Clovis,1.0
699,CA: CONCORD POLICE DEPARTMENT,12.0,477281.33999999997,CA: Concord,5.0
706,CA: CORONA POLICE DEPARTMENT,20.0,14980.0,CA: Corona,3.0
710,CA: COVINA POLICE DEPARTMENT,435.0,5752474.38,CA: Covina,1.0
713,CA: DELANO POLICE DEPARTMENT,343.0,233029.06,CA: Delano,4.0
719,CA: EL MONTE POLICE DEPARTMENT,145.0,890074.76,CA: El Monte,4.0
724,CA: ELK GROVE POLICE DEPARTMENT,2.0,154000.0,CA: Elk Grove,2.0
726,CA: ESCALON POLICE DEPARTMENT,4.0,1996.0,CA: Escalon,1.0
727,CA: ESCONDIDO POLICE DEPARTMENT,41.0,95030.0,CA: Valley Center,3.0
734,CA: FRESNO POLICE DEPARTMENT,3.0,30000.0,CA: Fresno,23.0
758,CA: GARDEN GROVE POLICE DEPARTMENT,3.0,887000.0,CA: Garden Grove,5.0
763,CA: GARDENA POLICE DEPARTMENT,23.0,464471.42,CA: Gardena,4.0
767,CA: GILROY POLICE DEPARTMENT,6.0,2994.0,CA: Gilroy,2.0
769,CA: GLENDORA POLICE DEPARTMENT,1.0,65070.0,CA: Glendora,1.0
773,CA: HAWTHORNE POLICE DEPARTMENT,764.0,611524.9400000001,CA: Hawthorne,2.0
775,CA: HAYWARD POLICE DEPARTMENT,1.0,77000.0,CA: Hayward,6.0
781,CA: HEMET POLICE DEPARTMENT,1.0,10000.0,CA: Hemet,4.0
798,CA: LIVERMORE POLICE DEPARTMENT,108.0,4064.2599999999998,CA: Livermore,1.0
799,CA: LODI POLICE DEPARTMENT,34.0,213979.06,CA: Lodi,3.0
803,CA: LOS ANGELES POLICE DEPARTMENT,2355.0,714461.81,CA: Hollywood,124.0
930,CA: MANTECA POLICE DEPARTMENT,61.0,105878.12999999999,CA: Ripon,1.0
938,CA: MONTEREY PARK POLICE DEPARTMENT,329.0,573277.7600000001,CA: Monterey Park,1.0
941,CA: MURRIETA POLICE DEPARTMENT,3.0,539497.0,CA: Lake Elsinore,1.0
942,CA: NAPA POLICE DEPARTMENT,37.0,735011.0,CA: Napa,3.0
952,CA: OXNARD POLICE DEPARTMENT,205.0,56333.73999999999,CA: Oxnard,1.0
954,CA: PASADENA POLICE DEPARTMENT,143.0,364492.16,CA: Pasadena,3.0
962,CA: POMONA POLICE DEPARTMENT,36.0,487842.38,CA: Pomona,3.0
965,CA: PORT HUENEME POLICE DEPARTMENT,7.0,1699.1399999999999,CA: Port Hueneme,1.0
966,CA: RED BLUFF POLICE DEPARTMENT,2.0,8600.0,CA: Red Bluff,2.0
968,CA: REDDING POLICE DEPARTMENT,16.0,78800.0,CA: Redding,11.0
979,CA: REDLANDS POLICE DEPARTMENT,25.0,717113.7,CA: Redlands,3.0
982,CA: REDWOOD CITY POLICE DEPARTMENT,1.0,733000.0,CA: Redwood City,4.0
986,CA: RIALTO POLICE DEPARTMENT,20.0,14980.0,CA: Bloomington,3.0
989,CA: RIDGECREST POLICE DEPARTMENT,19.0,380670.0,CA: Ridgecrest,1.0
991,CA: ROCKLIN POLICE DEPARTMENT,10.0,335.0,CA: Rocklin,1.0
994,CA: SACRAMENTO POLICE DEPARTMENT,25.0,110080.38,CA: Sacramento,12.0
1007,CA: SALINAS POLICE DEPARTMENT,1.0,658000.0,CA: Salinas,8.0
1016,CA: SAN DIEGO POLICE DEPARTMENT,2.0,154000.0,CA: San Diego,29.0
1046,CA: SAN FRANCISCO POLICE DEPARTMENT,208.0,278721.52,CA: San Francisco,18.0
1066,CA: SAN JOSE POLICE DEPARTMENT,586.0,854912.0799999997,CA: San Jose,22.0
1091,CA: SAN MATEO POLICE DEPARTMENT,22.0,81158.51,CA: Pacifica,1.0
1094,CA: SANTA ANA POLICE DEPARTMENT,8.0,80167.0,CA: Santa Ana,16.0
1112,CA: SANTA MARIA POLICE DEPARTMENT,87.0,55506.5,CA: Santa Maria,5.0
1117,CA: SANTA MONICA POLICE DEPARTMENT,1.0,400.0,CA: Santa Monica,1.0
1118,CA: SANTA PAULA POLICE DEPARTMENT,1.0,658000.0,CA: Santa Paula,1.0
1119,CA: SELMA POLICE DEPARTMENT,92.0,59205.07,CA: Selma,1.0
1124,CA: SOUTH GATE POLICE DEPARTMENT,2.0,766000.0,CA: South Gate,6.0
1130,CA: SOUTH LAKE TAHOE POLICE DEPARTMENT,346.0,1137268.85,CA: South Lake Tahoe,1.0
1132,CA: SOUTH SAN FRANCISCO POLICE DEPARTMENT,23.0,736676.0,CA: San Francisco,1.0
1134,CA: TEHACHAPI POLICE DEPARTMENT,20.0,59.99,CA: Golden Hills,2.0
1140,CA: TULARE POLICE DEPARTMENT,25.0,18725.0,CA: Tulare,4.0
1146,CA: VACAVILLE POLICE DEPARTMENT,122.0,738154.51,CA: Vacaville,4.0
1150,CA: VALLEJO POLICE DEPARTMENT,5.0,962070.0,CA: Vallejo,8.0
1159,CA: WALNUT CREEK POLICE DEPARTMENT,2.0,154000.0,CA: Walnut Creek,1.0
1160,CA: WATSONVILLE POLICE DEPARTMENT,14.0,2008.55,CA: Pajaro,1.0
1161,CA: WEST COVINA POLICE DEPARTMENT,340.0,2043422.02,CA: Glendale,3.0
1166,CA: WHITTIER POLICE DEPARTMENT,5.0,811170.55,CA: Whittier,3.0
1169,CA: WOODLAND POLICE DEPARTMENT,84.0,740128.5200000001,CA: Woodland,3.0
1174,CA: YUBA CITY POLICE DEPARTMENT,1.0,733000.0,CA: Yuba City,2.0
1182,CO: ALAMOSA POLICE DEPARTMENT,5.0,690996.0,CO: Alamosa,1.0
1186,CO: AURORA POLICE DEPARTMENT,385.0,599229.92,CO: Aurora,18.0
1208,CO: BOULDER POLICE DEPARTMENT,106.0,3657.33,CO: Boulder,1.0
1217,CO: BROOMFIELD POLICE DEPARTMENT,18.0,4496.639999999999,CO: Broomfield,1.0
1220,CO: CANON CITY POLICE DEPARTMENT,493.0,42407.55,CO: Canon City,1.0
1226,CO: COLORADO SPRINGS POLICE DEPARTMENT,34.0,502843.65,CO: Colorado Springs,15.0
1242,CO: COMMERCE CITY POLICE DEPARTMENT,1.0,495000.0,CO: Commerce City,1.0
1255,CO: ENGLEWOOD POLICE DEPARTMENT,19.0,1048.53,CO: Englewood,1.0
1260,CO: FORT LUPTON POLICE DEPARTMENT,2.0,82122.0,CO: Fort Lupton,1.0
1261,CO: FOUNTAIN POLICE DEPARTMENT,1.0,495000.0,CO: Fountain,1.0
1265,CO: GREELEY POLICE DEPARTMENT,750.0,1896174.2,CO: Greeley,8.0
1289,CO: LAKEWOOD POLICE DEPARTMENT,727.0,61176.44000000001,CO: Lakewood,1.0
1309,CO: LONGMONT POLICE DEPARTMENT,35.0,28100.0,CO: Longmont,2.0
1311,CO: LOVELAND POLICE DEPARTMENT,6.0,12804.58,CO: Loveland,3.0
1322,CO: MOUNTAIN VIEW POLICE DEPARTMENT,8.0,714.84,CO: Denver,1.0
1323,CO: NORTHGLENN POLICE DEPARTMENT,2.0,659808.8,CO: Westminster,4.0
1338,CO: PUEBLO POLICE DEPARTMENT,11.0,734380.0,CO: Pueblo,17.0
1355,CO: ROCKY FORD POLICE DEPARTMENT,210.0,100433.93000000001,CO: Rocky Ford,1.0
1365,CO: THORNTON POLICE DEPARTMENT,234.0,5140.92,CO: Thornton,3.0
1368,CO: TRINIDAD POLICE DEPARTMENT,112.0,317615.19,CO: Trinidad,2.0
1373,CO: WESTMINSTER POLICE DEPARTMENT,74.0,2150.2599999999998,CO: Denver,10.0
1385,CO: WOODLAND PARK POLICE DEPARTMENT,21.0,48551.97,CO: Woodland Park,1.0
1390,CT: BRIDGEPORT POLICE DEPARTMENT,1.0,192513.0,CT: Bridgeport,3.0
1397,CT: DANBURY POLICE DEPARTMENT,24.0,73084.0,CT: Danbury,1.0
1399,CT: EAST HARTFORD POLICE DEPARTMENT,39.0,40461.0,CT: East Hartford,2.0
1403,CT: FAIRFIELD POLICE DEPARTMENT,1.0,150000.0,CT: Fairfield,1.0
1404,CT: FARMINGTON POLICE DEPARTMENT,16.0,740485.0,CT: Farmington,1.0
1407,CT: HARTFORD POLICE DEPARTMENT,5.0,689000.0,CT: Hartford,3.0
1413,CT: MERIDEN POLICE DEPARTMENT,3.0,147192.0,CT: Meriden,1.0
1418,CT: NEW BRITAIN POLICE DEPARTMENT,468.0,979512.58,CT: New Britain,2.0
1423,CT: NORWICH POLICE DEPARTMENT,1.0,65070.0,CT: Norwich,1.0
1430,CT: RIDGEFIELD POLICE DEPARTMENT,20.0,57756.0,CT: Ridgefield,1.0
1435,CT: SUFFIELD POLICE DEPARTMENT,2.0,62457.0,CT: Suffield,1.0
1440,CT: WATERBURY POLICE DEPARTMENT,1.0,733000.0,CT: Waterbury,1.0
1446,CT: WETHERSFIELD POLICE DEPARTMENT,11.0,16989.0,CT: Wethersfield,1.0
1447,CT: WILLIMANTIC POLICE DEPARTMENT,413.0,846831.6799999997,CT: Willimantic,1.0
1475,DE: MILFORD POLICE DEPARTMENT,41.0,495857.42,DE: Milford,1.0
1482,DE: SMYRNA POLICE DEPARTMENT,4.0,1636.8,DE: Smyrna,1.0
1494,FL: BOYNTON BEACH POLICE DEPARTMENT,1.0,89900.0,FL: Boynton Beach,2.0
1496,FL: BRADENTON POLICE DEPARTMENT,174.0,125291.89,FL: Bradenton,2.0
1503,FL: CLEARWATER POLICE DEPARTMENT,2.0,822900.0,FL: Clearwater,4.0
1510,FL: CORAL GABLES POLICE DEPARTMENT,4.0,826365.76,FL: Miami,1.0
1511,FL: CRESTVIEW POLICE DEPARTMENT,1.0,658000.0,FL: Crestview,1.0
1515,FL: DELRAY BEACH POLICE DEPARTMENT,314.0,735992.5800000001,FL: Delray Beach,1.0
1518,FL: EUSTIS POLICE DEPARTMENT,5.0,125000.0,FL: Eustis,1.0
1529,FL: FORT LAUDERDALE POLICE DEPARTMENT,7.0,260247.91,FL: Fort Lauderdale,3.0
1533,FL: FORT PIERCE POLICE DEPARTMENT,32.0,1161376.9999999993,FL: Fort Pierce,3.0
1536,FL: FORT WALTON BEACH POLICE DEPARTMENT,11.0,112116.0,FL: Fort Walton Beach,1.0
1539,FL: GAINESVILLE POLICE DEPARTMENT,90.0,958075.1299999999,FL: Gainesville,1.0
1545,FL: HALLANDALE BEACH POLICE DEPARTMENT,37.0,753340.0,FL: Hallandale Beach,2.0
1552,FL: HIALEAH POLICE DEPARTMENT,1.0,658000.0,FL: Miami,4.0
1569,FL: LAKELAND POLICE DEPARTMENT,1.0,733000.0,FL: Lakeland,4.0
1574,FL: LARGO POLICE DEPARTMENT,71.0,90883.99999999994,FL: Largo,1.0
1576,FL: LEESBURG POLICE DEPARTMENT,31.0,734254.0,FL: Leesburg,1.0
1584,FL: MIAMI BEACH POLICE DEPARTMENT,26.0,1474365.8599999999,FL: Miami Beach,3.0
1587,FL: MIAMI GARDENS POLICE DEPARTMENT,102.0,717900.0,FL: Miami Gardens,3.0
1597,FL: OCALA POLICE DEPARTMENT,46.0,757565.5,FL: Ocala,3.0
1600,FL: OCOEE POLICE DEPARTMENT,10.0,1200.0,FL: Ocoee,1.0
1603,FL: ORANGE CITY POLICE DEPARTMENT,1.0,77522.0,FL: Orange City,1.0
1605,FL: ORLANDO POLICE DEPARTMENT,29.0,8494.029999999999,FL: Orlando,18.0
1624,FL: PALATKA POLICE DEPARTMENT,20.0,10917.999999999996,FL: Palatka,2.0
1626,FL: PALM BAY POLICE DEPARTMENT,37.0,434930.15,FL: Palm Bay,3.0
1631,FL: PANAMA CITY BEACH POLICE DEPARTMENT,7.0,414805.28,FL: Panama City Beach,1.0
1634,FL: PINELLAS PARK POLICE DEPARTMENT,2.0,668000.0,FL: Pinellas Park,2.0
1636,FL: PLANT CITY POLICE DEPARTMENT,20.0,14980.0,FL: Plant City,3.0
1643,FL: PUNTA GORDA POLICE DEPARTMENT,20.0,8690.0,FL: Punta Gorda,1.0
1652,FL: SARASOTA POLICE DEPARTMENT,2.0,120818.0,FL: Sarasota,1.0
1663,FL: TAMPA POLICE DEPARTMENT,5.0,325341.0,FL: Tampa,1.0
1679,FL: TARPON SPRINGS POLICE DEPARTMENT,16.0,734800.0,FL: Tarpon Springs,2.0
1690,FL: WEST MELBOURNE POLICE DEPARTMENT,7.0,662494.0,FL: West Melbourne,1.0
1695,GA: ADAIRSVILLE POLICE DEPARTMENT,1.0,41061.0,GA: Adairsville,1.0
1696,GA: ALBANY POLICE DEPARTMENT,25.0,12475.0,GA: Albany,1.0
1699,GA: ATLANTA POLICE DEPARTMENT,1.0,77111.0,GA: Atlanta,15.0
1734,GA: CALHOUN POLICE DEPARTMENT,1.0,126665.0,GA: Calhoun,1.0
1741,GA: CHAMBLEE POLICE DEPARTMENT,773.0,79955.92,GA: Chamblee,2.0
1748,GA: CLAYTON COUNTY POLICE DEPARTMENT,18.0,236720.0,GA: Morrow,5.0
1754,GA: CLAYTON POLICE DEPARTMENT,88.0,182050.08,GA: Clayton,1.0
1755,GA: COBB COUNTY POLICE DEPARTMENT,1.0,65070.0,GA: Atlanta,12.0
1770,GA: COLUMBUS POLICE DEPARTMENT,37.0,784172.9,GA: Columbus,2.0
1781,GA: DOUGLAS POLICE DEPARTMENT,20.0,2400.0,GA: Douglas,1.0
1795,GA: FOREST PARK POLICE DEPARTMENT,4.0,183458.7,GA: Forest Park,1.0
1828,GA: JONESBORO POLICE DEPARTMENT,31.0,129301.09000000001,GA: Jonesboro,1.0
1829,GA: KINGSLAND POLICE DEPARTMENT,32.0,1775.0,GA: Kingsland,1.0
1835,GA: LEESBURG POLICE DEPARTMENT,32.0,63455.4,GA: Leesburg,1.0
1851,GA: MONROE POLICE DEPARTMENT,1295.0,163138.41999999995,GA: Monroe,1.0
1877,GA: PORT WENTWORTH POLICE DEPARTMENT,56.0,458407.31999999995,GA: Port Wentworth,1.0
1891,GA: SANDY SPRINGS POLICE DEPARTMENT,1.0,14463.67,GA: Sandy Springs,1.0
1896,GA: STATESBORO POLICE DEPARTMENT,73.0,195098.33000000002,GA: Statesboro,1.0
1913,GA: UNION CITY POLICE DEPARTMENT,28.0,828.6800000000002,GA: Union City,1.0
1922,GA: WARNER ROBINS POLICE DEPARTMENT,2346.0,2467113.8000000003,GA: Kathleen,1.0
1926,GA: WAYCROSS POLICE DEPARTMENT,10.0,844759.3999999999,GA: Waycross,2.0
1936,GA: WOODSTOCK POLICE DEPARTMENT,29.0,82470.69,GA: Kennesaw,2.0
1943,IA: CEDAR RAPIDS POLICE DEPARTMENT,4.0,71061.0,IA: Cedar Rapids,2.0
1957,IA: FORT MADISON POLICE DEPARTMENT,1.0,41061.0,IA: Fort Madison,3.0
1969,IA: IOWA STATE PATROL,1.0,50458.0,IA: Moorland,2.0
1982,IA: MARSHALLTOWN POLICE DEPARTMENT,2.0,774061.0,IA: Marshalltown,1.0
1986,IA: MITCHELLVILLE POLICE DEPARTMENT,46.0,41435.74,IA: Mitchellville,1.0
1994,IA: SIOUX CITY POLICE DEPARTMENT,1.0,733000.0,IA: Sioux City,2.0
2030,ID: IDAHO FALLS POLICE DEPARTMENT,1.0,188000.0,ID: Idaho Falls,2.0
2035,ID: LEWISTON POLICE DEPARTMENT,78.0,688472.37,ID: Lewiston,1.0
2039,ID: NAMPA POLICE DEPARTMENT,3.0,539788.0,ID: Nampa,2.0
2046,ID: REXBURG POLICE DEPARTMENT,300.0,282190.83000000013,ID: Rexburg,1.0
2062,IL: BELLEVILLE POLICE DEPARTMENT,159.0,225813.45,IL: Belleville,2.0
2103,IL: DES PLAINES POLICE DEPARTMENT,1.0,12100.0,IL: Chicago,1.0
2123,IL: FOREST PARK POLICE DEPARTMENT,894.0,254210.02000000005,IL: Forest Park,1.0
2134,IL: GRANITE CITY POLICE DEPARTMENT,3.0,94437.0,IL: Granite City,1.0
2157,IL: JOLIET POLICE DEPARTMENT,11.0,11090.0,IL: Joliet,3.0
2170,IL: LAKEMOOR POLICE DEPARTMENT,13.0,23334.940000000002,IL: Lakemoor,1.0
2178,IL: LISLE POLICE DEPARTMENT,22.0,1676.0,IL: Lisle,1.0
2195,IL: MELROSE PARK POLICE DEPARTMENT,5.0,3745.0,IL: Maywood,1.0
2197,IL: METROPOLIS POLICE DEPARTMENT,204.0,1050096.74,IL: Metropolis,1.0
2218,IL: NORTH AURORA POLICE DEPARTMENT,106.0,280634.25,IL: North Aurora,2.0
2233,IL: PEORIA POLICE DEPARTMENT,6.0,4494.0,IL: Peoria,3.0
2246,IL: QUINCY POLICE DEPARTMENT,1.0,41061.0,IL: Quincy,1.0
2249,IL: RIVER FOREST POLICE DEPARTMENT,2.0,1498.0,IL: River Forest,1.0
2254,IL: ROCKFORD POLICE DEPARTMENT,1.0,733000.0,IL: Rockford,3.0
2273,IL: SLEEPY HOLLOW POLICE DEPARTMENT,2.0,61680.0,IL: Buffalo Grove,1.0
2279,IL: SPRINGFIELD POLICE DEPARTMENT,10.0,102506.69,IL: Springfield,1.0
2289,IL: THORNTON POLICE DEPARTMENT,2.0,1498.0,IL: Thornton,1.0
2305,IL: WAUCONDA POLICE DEPARTMENT,17.0,11483.0,IL: Wauconda,1.0
2306,IL: WAUKEGAN POLICE DEPARTMENT,1.0,150000.0,IL: Waukegan,1.0
2340,IN: BEECH GROVE POLICE DEPARTMENT,1.0,41447.0,IN: Beech Grove,1.0
2348,IN: CARMEL POLICE DEPARTMENT,4.0,19581.56,IN: Indianapolis,1.0
2353,IN: CLARKSVILLE POLICE DEPARTMENT,1.0,50458.0,IN: Clarksville,1.0
2372,IN: ELKHART POLICE DEPARTMENT,2.0,689046.82,IN: Elkhart,5.0
2379,IN: FISHERS POLICE DEPARTMENT,3.0,689000.0,IN: Fishers,1.0
2380,IN: FORT WAYNE POLICE DEPARTMENT,1.0,610764.0,IN: Fort Wayne,9.0
2390,IN: GARY POLICE DEPARTMENT,2.0,95374.7,IN: Gary,3.0
2400,IN: GREENWOOD POLICE DEPARTMENT,7.0,666114.86,IN: Greenwood,2.0
2415,IN: INDIANA STATE POLICE,1.0,495088.35,IN: Dale,2.0
2451,IN: LAKE STATION POLICE DEPARTMENT,13.0,28262.7,IN: Lake Station,1.0
2454,IN: LAWRENCE POLICE DEPARTMENT,1.0,733000.0,IN: Lawrence,1.0
2461,IN: MARION POLICE DEPARTMENT,45.0,33705.0,IN: Marion,1.0
2465,IN: MERRILLVILLE POLICE DEPARTMENT,11.0,479954.20999999996,IN: Merrillville,1.0
2477,IN: MUNCIE POLICE DEPARTMENT,108.0,1048469.1199999995,IN: Muncie,3.0
2482,IN: NEW ALBANY POLICE DEPARTMENT,114.0,159307.38,IN: New Albany,1.0
2499,IN: PORTAGE POLICE DEPARTMENT,12.0,983325.0,IN: Portage,1.0
2509,IN: SALEM POLICE DEPARTMENT,56.0,106537.01,IN: Salem,1.0
2514,IN: SHELBYVILLE POLICE DEPARTMENT,216.0,441946.9099999998,IN: Shelbyville,1.0
2516,IN: SOUTH BEND POLICE DEPARTMENT,3.0,1947.0,IN: South Bend,3.0
2522,IN: TERRE HAUTE POLICE DEPARTMENT,45.0,1058789.0,IN: Terre Haute,1.0
2536,IN: WEST TERRE HAUTE POLICE DEPARTMENT,218.0,135402.05000000002,IN: Terre Haute,1.0
2586,KS: NEWTON POLICE DEPARTMENT,6.0,720.0,KS: Newton,2.0
2588,KS: OLATHE POLICE DEPARTMENT,1.0,412000.0,KS: Olathe,2.0
2600,KS: SALINA POLICE DEPARTMENT,1.0,200000.0,KS: Salina,1.0
2649,KY: ELKTON POLICE DEPARTMENT,14.0,1605.0,KY: Elkton,1.0
2660,KY: FULTON POLICE DEPARTMENT,30.0,25.95,KY: Fulton,1.0
2687,KY: JEFFERSONTOWN POLICE DEPARTMENT,829.0,169833.93999999997,KY: Louisville,2.0
2708,KY: LOUISVILLE METRO POLICE DEPARTMENT,1040.0,286036.5999999999,KY: Louisville,22.0
2730,KY: LUDLOW POLICE DEPARTMENT,6.0,47121.0,KY: Ludlow,1.0
2757,KY: OWENSBORO POLICE DEPARTMENT,3.0,793955.0,KY: Owensboro,1.0
2770,KY: RUSSELLVILLE POLICE DEPARTMENT,20.0,41396.0,KY: Russellville,1.0
2800,KY: WILMORE POLICE DEPARTMENT,10.0,127106.70999999999,KY: Wilmore,1.0
2805,LA: BATON ROUGE POLICE DEPARTMENT,100.0,1294302.0,LA: Baton Rouge,10.0
2817,LA: BOGALUSA POLICE DEPARTMENT,10.0,4990.0,LA: Bogalusa,1.0
2818,LA: BOSSIER CITY POLICE DEPARTMENT,1.0,865000.0,LA: Bossier City,2.0
2828,LA: GRETNA POLICE DEPARTMENT,4.0,965566.0,LA: Gretna,1.0
2830,LA: KENNER POLICE DEPARTMENT,1.0,658000.0,LA: Kenner,3.0
2835,LA: LAFAYETTE POLICE DEPARTMENT,2.0,93966.0,LA: Lafayette,1.0
2837,LA: LAKE CHARLES POLICE DEPARTMENT,46.0,824860.0,LA: Lake Charles,2.0
2844,LA: NEW ORLEANS POLICE DEPARTMENT,2.0,998.0,LA: New Orleans,11.0
2858,LA: PINEVILLE POLICE DEPARTMENT,32.0,803058.1999999994,LA: Pineville,1.0
2870,LA: WEST MONROE POLICE DEPARTMENT,12.0,5266.0,LA: West Monroe,2.0
2873,MA: AUBURN POLICE DEPARTMENT,45.0,8959.1,MA: Auburn,2.0
2878,MA: CHELSEA POLICE DEPARTMENT,10.0,7490.0,MA: Chelsea,2.0
2881,MA: COHASSET POLICE DEPARTMENT,14.0,1593.42,MA: Cohasset,1.0
2884,MA: DARTMOUTH POLICE DEPARTMENT,2.0,130961.0,MA: Dartmouth,1.0
2888,MA: EVERETT POLICE DEPARTMENT,10.0,132188.0,MA: Everett,2.0
2890,MA: FALL RIVER POLICE DEPARTMENT,2.0,179800.0,MA: Fall River,2.0
2905,MA: LYNN POLICE DEPARTMENT,10.0,7490.0,MA: Lynn,5.0
2927,MA: SALISBURY POLICE DEPARTMENT,13.0,51128.0,MA: Salisbury,1.0
2945,MA: WORCESTER POLICE DEPARTMENT,4.0,46373.95,MA: Worcester,1.0
2948,MD: ANNAPOLIS POLICE DEPARTMENT,3.0,335.0,MD: Annapolis,1.0
2950,MD: ANNE ARUNDEL COUNTY POLICE DEPARTMENT,30.0,9715.0,MD: Glen Burnie,4.0
2958,MD: BLADENSBURG POLICE DEPARTMENT,32.0,11628.04,MD: Bladensburg,1.0
2976,MD: GREENBELT POLICE DEPARTMENT,10.0,670.0,MD: Greenbelt,1.0
2988,MD: MONTGOMERY COUNTY POLICE DEPARTMENT,1.0,733000.0,MD: Silver Spring,9.0
3008,MD: RISING SUN POLICE DEPARTMENT,1.0,62627.0,MD: Rising Sun,1.0
3025,ME: CALAIS POLICE DEPARTMENT,1.0,3788.4,ME: Calais,1.0
3033,ME: GORHAM POLICE DEPARTMENT,2.0,2087.0,ME: Gorham,1.0
3049,ME: PORTLAND POLICE DEPARTMENT,31.0,65740.0,ME: Portland,1.0
3050,ME: PRESQUE ISLE POLICE DEPARTMENT,103.0,244243.76,ME: Presque Isle,2.0
3084,MI: BATTLE CREEK POLICE DEPARTMENT,16.0,124199.98999999999,MI: Battle Creek,1.0
3089,MI: BENTON HARBOR DEPARTMENT OF PUBLIC SAFETY,104.0,422668.29,MI: Benton Harbor,1.0
3113,MI: DEARBORN HEIGHTS POLICE DEPARTMENT,9.0,736369.0,MI: Dearborn Heights,1.0
3114,MI: DEARBORN POLICE DEPARTMENT,161.0,629760.32,MI: Dearborn,2.0
3117,MI: DETROIT POLICE DEPARTMENT,182.0,306577.64,MI: Detroit,12.0
3142,MI: FLINT POLICE DEPARTMENT,3.0,783409.0,MI: Flint,1.0
3144,MI: FLINT TOWNSHIP POLICE DEPARTMENT,139.0,155837.79999999996,MI: Flint Township,1.0
3162,MI: GRAND RAPIDS POLICE DEPARTMENT,187.0,323.52000000000004,MI: Grand Rapids,1.0
3175,MI: INKSTER POLICE DEPARTMENT,10.0,419835.0,MI: Inkster,1.0
3184,MI: KENTWOOD POLICE DEPARTMENT,52.0,903.34,MI: Grand Rapids,3.0
3211,MI: MICHIGAN STATE POLICE,262.0,2991910.0799999996,MI: Sebewaing,5.0
3233,MI: NILES POLICE DEPARTMENT,23.0,994634.0,MI: Niles,1.0
3265,MI: SHELBY TOWNSHIP POLICE DEPARTMENT,62.0,4511.51,MI: Shelby Charter Township,2.0
3271,MI: STERLING HEIGHTS POLICE DEPARTMENT,136.0,741449.62,MI: Sterling Heights,1.0
3276,MI: TROY POLICE DEPARTMENT,1.0,49897.0,MI: Troy,1.0
3288,MI: WESTLAND POLICE DEPARTMENT,110.0,744093.76,MI: Westland,1.0
3293,MI: WYOMING DEPARTMENT OF PUBLIC SAFETY,111.0,213281.54,MI: Wyoming,1.0
3299,MN: AUSTIN POLICE DEPARTMENT,1.0,60409.0,MN: Austin,1.0
3300,MN: AVON POLICE DEPARTMENT,3.0,378.0,MN: St. Cloud,1.0
3304,MN: BLOOMINGTON POLICE DEPARTMENT,30.0,335.0,MN: Bloomington,1.0
3309,MN: BURNSVILLE POLICE DEPARTMENT,335.0,310534.77999999997,MN: Burnsville,2.0
3322,MN: DULUTH POLICE DEPARTMENT,218.0,27592.03,MN: Duluth,1.0
3339,MN: LINO LAKES POLICE DEPARTMENT,25.0,12475.0,MN: Fridley,1.0
3342,MN: MANKATO DEPARTMENT OF PUBLIC SAFETY,42.0,5040.0,MN: Mankato,1.0
3347,MN: MINNETONKA POLICE DEPARTMENT,55.0,426610.0,MN: Minnetonka,1.0
3355,MN: NEW HOPE POLICE DEPARTMENT,46.0,665122.02,MN: New Hope,1.0
3368,MN: ROCHESTER POLICE DEPARTMENT,246.0,84402.17,MN: Rochester,1.0
3396,MO: AURORA POLICE DEPARTMENT,2.0,44209.0,MO: Aurora,1.0
3403,MO: BLUE SPRINGS POLICE DEPARTMENT,133.0,410623.62000000005,MO: Blue Springs,1.0
3419,MO: CAPE GIRARDEAU POLICE DEPARTMENT,1.0,77000.0,MO: Cape Girardeau,1.0
3456,MO: FERGUSON POLICE DEPARTMENT,2.0,90958.0,MO: Ferguson,1.0
3481,MO: INDEPENDENCE POLICE DEPARTMENT,1.0,10000.0,MO: Kansas City,6.0
3493,MO: JEFFERSON CITY POLICE DEPARTMENT,50.0,45027.0,MO: Martinsburg,2.0
3498,MO: JOPLIN POLICE DEPARTMENT,59.0,845336.62,MO: Joplin,1.0
3531,MO: MONETT POLICE DEPARTMENT,10.0,691135.0,MO: Monett,1.0
3537,MO: MOUNTAIN VIEW POLICE DEPARTMENT,3.0,86227.0,MO: Mountain View,1.0
3571,MO: REPUBLIC POLICE DEPARTMENT,2.0,82122.0,MO: Republic,1.0
3621,MS: BILOXI POLICE DEPARTMENT,27.0,10946.0,MS: Biloxi,2.0
3623,MS: BROOKHAVEN POLICE DEPARTMENT,2.0,269684.0,MS: Brookhaven,1.0
3625,MS: CLINTON POLICE DEPARTMENT,21.0,28726.0,MS: Clinton,1.0
3626,MS: COLUMBUS POLICE DEPARTMENT,1.0,138.0,MS: Columbus,1.0
3634,MS: GULFPORT POLICE DEPARTMENT,1.0,865000.0,MS: Gulfport,4.0
