,stStation,Quantity,Acquisition Value,city_name,deaths
9410,CA: CHULA VISTA POLICE DEPARTMENT,0.0,0.0,CA: Chula Vista,2.0
9412,GA: GEORGIA TECH POLICE DEPARTMENT,0.0,0.0,GA: Atlanta,1.0
9413,VA: PRINCE WILLIAM COUNTY POLICE DEPARTMENT,0.0,0.0,VA: Haymarket,1.0
9414,TX: PLANO POLICE DEPARTMENT,0.0,0.0,TX: Plano,2.0
9416,WA: LONGVIEW POLICE DEPARTMENT,0.0,0.0,WA: Longview,1.0
9417,OH: STOW POLICE DEPARTMENT,0.0,0.0,OH: Akron,1.0
9418,MA: PITTSFIELD POLICE DEPARTMENT,0.0,0.0,MA: Pittsfield,1.0
9419,CT: NEW MILFORD POLICE DEPARTMENT,0.0,0.0,CT: New Milford,1.0
9420,MI: WATERFORD POLICE DEPARTMENT,0.0,0.0,MI: Waterford Township,1.0
9421,CO: REGIONAL TRANSPORTATION DISTRICT TRANSIT POLICE,0.0,0.0,CO: Denver,1.0
9422,OH: ADULT PROBATION DEPARTMENT JEFFERSON COUNTY COURTHOUSE,0.0,0.0,OH: Steubenville,1.0
9423,AR: U.S. NATIONAL PARK SERVICE,0.0,0.0,AR: Yellville,1.0
9424,NJ: BLOOMFIELD POLICE DEPARTMENT,0.0,0.0,NJ: Bloomfield,1.0
9425,IN: CRETE POLICE DEPARTMENT,0.0,0.0,IN: Dyer,1.0
9426,IL: DOLTON POLICE DEPARTMENT,0.0,0.0,IL: Dolton,2.0
9428,NJ: NORTH BERGEN POLICE DEPARTMENT,0.0,0.0,NJ: North Bergen,1.0
9429,OH: NEW STRAITSVILLE POLICE DEPARTMENT,0.0,0.0,OH: New Straitsville,1.0
9430,CA: SANTA ROSA POLICE DEPARTMENT,0.0,0.0,CA: Santa Rosa,1.0
9431,PA: WARREN CITY POLICE DEPARTMENT,0.0,0.0,PA: Clarendon,1.0
9432,MI: MARINE CITY POLICE DEPARTMENT,0.0,0.0,MI: Marine City,1.0
9433,WI: OSHKOSH POLICE DEPARTMENT,0.0,0.0,WI: Oshkosh,1.0
9434,NY: GLENVILLE POLICE DEPARTMENT,0.0,0.0,NY: Schenectady,1.0
9435,CA: AVENAL POLICE DEPARTMENT,0.0,0.0,CA: Avenal,2.0
9437,LA: LOUISIANA DEPARTMENT OF CORRECTIONS,0.0,0.0,LA: Homer,1.0
9438,MA: SPENCER POLICE DEPARTMENT,0.0,0.0,MA: Spencer,1.0
9439,MS: SOUTHAVEN POLICE DEPARTMENT,0.0,0.0,MS: Southaven,4.0
9443,WI: EAU CLAIRE POLICE DEPARTMENT,0.0,0.0,WI: Eau Claire,3.0
9446,MO: NEOSHO POLICE DEPARTMENT,0.0,0.0,MO: Neosho,1.0
9447,MI: SAGINAW TOWNSHIP POLICE DEPARTMENT,0.0,0.0,MI: Saginaw,1.0
9448,AZ: EAGAR POLICE DEPARTMENT,0.0,0.0,AZ: Eagar,2.0
9450,VA: NORFOLK POLICE DEPARTMENT,0.0,0.0,VA: Norfolk,11.0
9461,CA: LOS ALAMITOS POLICE DEPARTMENT,0.0,0.0,CA: Seal Beach,1.0
9462,CA: GROVER BEACH POLICE DEPARTMENT,0.0,0.0,CA: Grover Beach,1.0
9463,KS: LEAVENWORTH POLICE DEPARTMENT,0.0,0.0,KS: Leavenworth,2.0
9465,VA: HENRICO POLICE DEPARTMENT,0.0,0.0,VA: Richmond,1.0
9466,MD: HOWARD COUNTY POLICE DEPARTMENT,0.0,0.0,MD: Mount Airy,5.0
9471,WA: BAINBRIDGE ISLAND POLICE DEPARTMENT,0.0,0.0,WA: Bainbridge Island,1.0
9472,WA: WASHINGTON STATE PATROL,0.0,0.0,WA: Lacey,1.0
9476,UT: CENTERVILLE POLICE DEPARTMENT,0.0,0.0,UT: Farmington,2.0
9478,CO: FEDERAL HEIGHTS POLICE DEPARTMENT,0.0,0.0,CO: Federal Heights,1.0
9484,GA: BRUNSWICK POLICE DEPARTMENT,0.0,0.0,GA: Brunswick,1.0
9485,SC: NORTH CHARLESTON POLICE DEPARTMENT,0.0,0.0,SC: North Charleston,4.0
9489,NH: MASSACHUSETTS STATE POLICE,0.0,0.0,NH: Newton,1.0
9490,TN: SOMERVILLE POLICE DEPARTMENT,0.0,0.0,TN: Somerville,1.0
9491,VA: UNITED STATES CAPITOL POLICE,0.0,0.0,VA: Alexandria,1.0
9492,IL: JERSEYVILLE POLICE DEPARTMENT,0.0,0.0,IL: Jerseyville,1.0
9493,NH: NEW HAMPSHIRE DEPARTMENT OF SAFETY,0.0,0.0,NH: Hampton,1.0
9494,MS: PETAL POLICE DEPARTMENT,0.0,0.0,MS: Petal,1.0
9495,NC: CARY POLICE DEPARTMENT,0.0,0.0,NC: Cary,1.0
9496,ME: BELFAST POLICE DEPARTMENT,0.0,0.0,ME: Belfast,1.0
9497,WI: WEST MILWAUKEE POLICE DEPARTMENT,0.0,0.0,WI: West Milwaukee,1.0
9498,LA: CONVERSE POLICE DEPARTMENT,0.0,0.0,LA: Converse,1.0
9499,VA: ARLINGTON COUNTY POLICE DEPARTMENT,0.0,0.0,VA: Arlington,2.0
9501,CA: TUSTIN POLICE DEPARTMENT,0.0,0.0,CA: Tustin,2.0
9503,MO: COLUMBIA POLICE DEPARTMENT,0.0,0.0,MO: Columbia,1.0
9504,IN: GREENFIELD POLICE DEPARTMENT,0.0,0.0,IN: Greenfield,1.0
9505,CA: ROHNERT PARK POLICE DEPARTMENT,0.0,0.0,CA: Rohnert Park,1.0
9506,MA: BRAINTREE POLICE DEPARTMENT,0.0,0.0,MA: Braintree,2.0
9508,GA: PEACHTREE CITY POLICE DEPARTMENT,0.0,0.0,GA: Peachtree City,1.0
9509,TX: BALCH SPRINGS POLICE DEPARTMENT,0.0,0.0,TX: Balch Springs,2.0
9511,GA: FEDERAL BUREAU OF INVESTIGATION,0.0,0.0,GA: Atlanta,1.0
9512,PA: LEWISTOWN POLICE DEPARTMENT,0.0,0.0,PA: Lewistown,1.0
9513,OR: WEST LINN POLICE DEPARTMENT,0.0,0.0,OR: West Linn,1.0
9514,CA: NEWPORT BEACH POLICE DEPARTMENT,0.0,0.0,CA: Newport Beach,2.0
9516,ND: MANDAN POLICE DEPARTMENT,0.0,0.0,ND: Mandan,1.0
9517,NJ: PATERSON POLICE DEPARTMENT,0.0,0.0,NJ: Paterson,4.0
9521,PA: READING POLICE DEPARTMENT,0.0,0.0,PA: Reading,2.0
9523,SD: OGLALA SIOUX TRIBAL POLICE,0.0,0.0,SD: Kyle,2.0
9525,IN: GOSHEN POLICE DEPARTMENT,0.0,0.0,IN: Goshen,1.0
9526,SC: PENDLETON POLICE DEPARTMENT,0.0,0.0,SC: Pendleton,1.0
9527,IL: STOCKTON IL POLICE DEPARTMENT,0.0,0.0,IL: Stockton,1.0
9528,MI: MANISTEE DEPARTMENT OF PUBLIC SAFETY,0.0,0.0,MI: Manistee,1.0
9529,LA: CROWLEY POLICE DEPARTMENT,0.0,0.0,LA: Crowley,2.0
9531,GA: FULTON POLICE DEPARTMENT,0.0,0.0,GA: Atlanta,1.0
9532,MI: U.S. MARSHALS SERVICE,0.0,0.0,MI: Warren,1.0
9534,WA: BELLINGHAM POLICE DEPARTMENT,0.0,0.0,WA: Bellingham,1.0
9535,OH: STRONGSVILLE POLICE DEPARTMENT,0.0,0.0,OH: Strongsville,1.0
9536,TX: LUFKIN POLICE DEPARTMENT,0.0,0.0,TX: Lufkin,1.0
9537,LA: HOUMA POLICE DEPARTMENT,0.0,0.0,LA: Houma,1.0
9538,NC: SHELBY POLICE DEPARTMENT,0.0,0.0,NC: Shelby,1.0
9539,TX: LAKE JACKSON POLICE DEPARTMENT,0.0,0.0,TX: Lake Jackson,2.0
9541,OR: BEAVERTON POLICE DEPARTMENT,0.0,0.0,OR: Beaverton,4.0
9545,UT: ROY POLICE DEPARTMENT,0.0,0.0,UT: Roy,2.0
9547,OH: KENT POLICE DEPARTMENT,0.0,0.0,OH: Kent,3.0
9550,CA: NEWMAN POLICE DEPARTMENT,0.0,0.0,CA: Newman,1.0
9551,NC: GREENSBORO POLICE DEPARTMENT,0.0,0.0,NC: Greensboro,3.0
9554,NJ: BRIDGETON POLICE DEPARTMENT,0.0,0.0,NJ: Bridgeton,2.0
9556,ME: GWINNETT COUNTY POLICE DEPARTMENT,0.0,0.0,ME: Vassalboro,2.0
9558,WA: LAKE STEVENS POLICE DEPARTMENT,0.0,0.0,WA: Lake Stevens,1.0
9559,OK: ANADARKO POLICE DEPARTMENT,0.0,0.0,OK: Anadarko,1.0
9560,IL: AMTRAK POLICE DEPARTMENT,0.0,0.0,IL: Chicago,1.0
9561,IN: BROOKVILLE POLICE DEPARTMENT,0.0,0.0,IN: Brookville,1.0
9562,OH: WEATHERSFIELD POLICE DEPARTMENT,0.0,0.0,OH: Warren,1.0
9563,NC: NORTH CAROLINA HIGHWAY PATROL,0.0,0.0,NC: Lumberton,2.0
9565,NC: HICKORY POLICE DEPARTMENT,0.0,0.0,NC: Hickory,2.0
9567,WV: GRAFTON CITY POLICE DEPARTMENT,0.0,0.0,WV: Grafton,1.0
9568,OK: KIOWA POLICE DEPARTMENT,0.0,0.0,OK: Kiowa,1.0
9569,CT: MONTVILLE POLICE DEPARTMENT,0.0,0.0,CT: Oakdale,1.0
9570,CA: ALHAMBRA POLICE DEPARTMENT,0.0,0.0,CA: Alhambra,2.0
9572,OH: MADISON TOWNSHIP POLICE DEPARTMENT,0.0,0.0,OH: Groveport,1.0
9573,ME: WALDOBORO POLICE DEPARTMENT,0.0,0.0,ME: Waldoboro,1.0
9574,IL: ROBBINS POLICE DEPARTMENT,0.0,0.0,IL: Chicago,1.0
9575,MO: FLORISSANT POLICE DEPARTMENT,0.0,0.0,MO: Florissant,1.0
9576,VA: FAIRFAX COUNTY POLICE,0.0,0.0,VA: Herndon,1.0
9577,NJ: CAMDEN COUNTY POLICE DEPARTMENT,0.0,0.0,NJ: Camden,3.0
9580,PA: SHARON POLICE DEPARTMENT,0.0,0.0,PA: Sharon,1.0
9581,IL: ORLAND PARK POLICE DEPARTMENT,0.0,0.0,IL: Deerfield,1.0
9582,CA: DINUBA POLICE DEPARTMENT,0.0,0.0,CA: Dinuba,1.0
9583,OH: SPRINGFIELD TOWNSHIP POLICE DEPARTMENT,0.0,0.0,OH: Cincinnati,2.0
9585,MN: MANKATO POLICE DEPARTMENT,0.0,0.0,MN: Mankato,1.0
9586,IL: NORTH RIVERSIDE POLICE DEPARTMENT,0.0,0.0,IL: North Riverside,1.0
9587,OR: BEND POLICE DEPARTMENT,0.0,0.0,OR: Bend,2.0
9589,AL: SARALAND POLICE DEPARTMENT,0.0,0.0,AL: Saraland,1.0
9590,OK: ELK CITY POLICE DEPARTMENT,0.0,0.0,OK: Burns Flat,1.0
9591,CA: BRAWLEY POLICE DEPARTMENT,0.0,0.0,CA: Brawley,1.0
9592,OR: DALLAS OR POLICE DEPARTMENT,0.0,0.0,OR: Dallas,1.0
9593,NC: BADIN POLICE DEPARTMENT,0.0,0.0,NC: Badin,1.0
9594,MD: COPPIN STATE POLICE DEPARTMENT,0.0,0.0,MD: Baltimore,1.0
9595,PA: U.S. MARSHALS SERVICE,0.0,0.0,PA: Philadelphia,1.0
9599,KS: MEDICINE LODGE POLICE DEPARTMENT,0.0,0.0,KS: Medicine Lodge,1.0
9600,NE: YORK POLICE DEPARTMENT,0.0,0.0,NE: York,1.0
9601,NC: LELAND POLICE DEPARTMENT,0.0,0.0,NC: Leland,1.0
9602,PA: FORKS TOWNSHIP POLICE DEPARTMENT,0.0,0.0,PA: Easton,1.0
9603,KS: HUTCHINSON POLICE DEPARTMENT,0.0,0.0,KS: Hutchinson,2.0
9605,OH: HUDSON POLICE DEPARTMENT,0.0,0.0,OH: Hudson,1.0
9606,TX: FRIENDSWOOD POLICE DEPARTMENT,0.0,0.0,TX: Friendswood,1.0
9607,IL: WASHINGTON PARK POLICE DEPARTMENT,0.0,0.0,IL: Cahokia,2.0
9609,OH: OHIO STATE UNIVERSITY POLICE DEPARTMENT,0.0,0.0,OH: Columbus,1.0
9610,MO: GLADSTONE POLICE DEPARTMENT,0.0,0.0,MO: Kansas City,1.0
9611,TX: WEBSTER POLICE DEPARTMENT,0.0,0.0,TX: Webster,1.0
9612,PA: SCOTT TOWNSHIP POLICE DEPARTMENT,0.0,0.0,PA: Bloomsburg,1.0
9613,GA: EAST POINT POLICE DEPARTMENT,0.0,0.0,GA: East Point,2.0
9615,CO: GRAND JUNCTION POLICE DEPARTMENT,0.0,0.0,CO: Grand Junction,4.0
9619,AL: COLUMBUS POLICE DEPARTMENT,0.0,0.0,AL: Phenix City,1.0
9620,TX: GLADEWATER POLICE DEPARTMENT,0.0,0.0,TX: Gladewater,1.0
9621,CA: PALM SPRINGS POLICE DEPARTMENT,0.0,0.0,CA: Palm Springs,1.0
9622,PA: CHAMBERSBURG POLICE DEPARTMENT,0.0,0.0,PA: Chambersburg,1.0
9623,NV: NEVADA HIGHWAY PATROL,0.0,0.0,NV: Carson City,1.0
9631,OH: BROOKVILLE POLICE DEPARTMENT,0.0,0.0,OH: Brookville,1.0
9632,OH: NORTH ROYALTON POLICE DEPARTMENT,0.0,0.0,OH: North Royalton,1.0
9633,NC: NORTH CAROLINA DEPARTMENT OF PUBLIC SAFETY,0.0,0.0,NC: Wadesboro,1.0
9634,CA: LINCOLN CA POLICE DEPARTMENT,0.0,0.0,CA: Lincoln,1.0
9635,OH: WILLOUGHBY POLICE DEPARTMENT,0.0,0.0,OH: Willoughby,1.0
9636,CA: SANTA CRUZ POLICE DEPARTMENT,0.0,0.0,CA: Santa Cruz,1.0
9638,OH: WESTLAKE POLICE DEPARTMENT,0.0,0.0,OH: Westlake,1.0
9639,CA: BURBANK POLICE DEPARTMENT,0.0,0.0,CA: Burbank,1.0
9640,NJ: VENTNOR POLICE DEPARTMENT,0.0,0.0,NJ: Ventnor,1.0
9641,IL: MARKHAM POLICE DEPARTMENT,0.0,0.0,IL: Markham,1.0
9642,MI: MICHIGAN STATE POLICE DEPARTMENT,0.0,0.0,MI: Belleville,10.0
9652,GA: VALDOSTA POLICE DEPARTMENT,0.0,0.0,GA: Valdosta,1.0
9653,CA: EL CAJON POLICE DEPARTMENT,0.0,0.0,CA: El Cajon,2.0
9655,NH: UNKNOWN,0.0,0.0,NH: Claremont,1.0
9656,CT: MASHANTUCKET PEQUOT TRIBAL POLICE DEPARTMENT,0.0,0.0,CT: Mashantucket,1.0
9657,WA: AURORA WA POLICE DEPARTMENT,0.0,0.0,WA: Auburn,1.0
9658,FL: TITUSVILLE POLICE DEPARTMENT,0.0,0.0,FL: Titusville,2.0
9660,TX: ELLIS POLICE DEPARTMENT,0.0,0.0,TX: Ennis,1.0
9661,WA: EAST WENATCHEE POLICE DEPARTMENT,0.0,0.0,WA: East Wenatchee,1.0
9662,IL: ROUND LAKE POLICE DEPARTMENT,0.0,0.0,IL: Round Lake,1.0
9663,CA: HUNTINGTON PARK POLICE DEPARTMENT,0.0,0.0,CA: Huntington Park,1.0
9665,OH: SYLVANIA TOWNSHIP POLICE DEPARTMENT,0.0,0.0,OH: Toledo,1.0
9666,MO: AURORA MO POLICE DEPARTMENT,0.0,0.0,MO: Verona,1.0
9667,TX: WEATHERFORD POLICE DEPARTMENT,0.0,0.0,TX: Weatherford,3.0
9670,CA: FEDERAL BUREAU OF INVESTIGATION,0.0,0.0,CA: Compton,1.0
9671,OR: REDMOND POLICE DEPARTMENT,0.0,0.0,OR: Redmond,1.0
9672,TN: SHELBYVILLE POLICE DEPARTMENT,0.0,0.0,TN: Shelbyville,1.0
9673,WI: NEW LONDON POLICE DEPARTMENT,0.0,0.0,WI: New London,1.0
9674,KS: HAYS POLICE DEPARTMENT,0.0,0.0,KS: Hays,1.0
9675,WA: KELSO POLICE DEPARTMENT,0.0,0.0,WA: Kelso,1.0
9679,CO: UNKNOWN,0.0,0.0,CO: Lakewood,2.0
9681,AR: MONTICELLO POLICE DEPARTMENT,0.0,0.0,AR: Monticello,1.0
9682,WA: TUKWILA POLICE DEPARTMENT,0.0,0.0,WA: Tukwila,2.0
9684,KY: LEXINGTON POLICE DEPARTMENT,0.0,0.0,KY: Harlan,2.0
9686,PA: HARRISBURG POLICE DEPARTMENT,0.0,0.0,PA: Harrisburg,2.0
9688,UT: CLEARFIELD POLICE DEPARTMENT,0.0,0.0,UT: Clearfield,1.0
9689,SC: LAKE CITY POLICE DEPARTMENT,0.0,0.0,SC: Lake City,1.0
9690,NJ: MANCHESTER TOWNSHIP DIVISION OF POLICE,0.0,0.0,NJ: Manchester Township,1.0
9691,NM: ARTESIA POLICE DEPARTMENT,0.0,0.0,NM: Artesia,1.0
9692,NM: GALLUP POLICE DEPARTMENT,0.0,0.0,NM: Gallup,1.0
9693,CA: ,0.0,0.0,CA: Winchester,1.0
9694,WI: SHEBOYGAN POLICE DEPARTMENT,0.0,0.0,WI: Sheboygan,1.0
9695,NY: MIDDLETOWN POLICE DEPARTMENT,0.0,0.0,NY: Middletown,2.0
9697,MI: ROMULUS POLICE DEPARTMENT,0.0,0.0,MI: Romulus,1.0
9698,OK: BROKEN BOW POLICE DEPARTMENT,0.0,0.0,OK: Broken Bow,1.0
9699,MN: ST. ANTHONY POLICE DEPARTMENT,0.0,0.0,MN: Falcon Heights,1.0
9700,MS: U.S. MARSHALS SERVICE,0.0,0.0,MS: Raymond,1.0
9701,CA: TEMECULA POLICE DEPARTMENT,0.0,0.0,CA: Temecula,2.0
9703,DC: METRO TRANSIT POLICE,0.0,0.0,DC: Washington,1.0
9704,NC: ASHEVILLE POLICE DEPARTMENT,0.0,0.0,NC: Asheville,2.0
9706,WY: U.S. MARSHALS SERVICE,0.0,0.0,WY: Douglas,1.0
9707,CA: UNKNOWN,0.0,0.0,CA: Long Beach,3.0
9710,NE: LINCOLN POLICE DEPARTMENT,0.0,0.0,NE: Lincoln,2.0
9712,CT: THOMASTON POLICE DEPARTMENT,0.0,0.0,CT: Thomaston,1.0
9713,MI: COLUMBIA TOWNSHIP POLICE DEPARTMENT,0.0,0.0,MI: Clarklake,1.0
9714,WI: WAUWATOSA POLICE DEPARTMENT,0.0,0.0,WI: Wauwatosa,2.0
9716,WY: MILLS POLICE DEPARTMENT,0.0,0.0,WY: Casper,1.0
9717,MS: TUPELO POLICE DEPARTMENT,0.0,0.0,MS: Tupelo,2.0
9719,MT: BUTTE POLICE DEPARTMENT,0.0,0.0,MT: Butte,1.0
9720,CA: US HOMELAND SECURITY,0.0,0.0,CA: Chula Vista,1.0
9721,NY: SCHENECTADY POLICE DEPARTMENT,0.0,0.0,NY: Schenectady,2.0
9723,AZ: US CUSTOMS AND BORDER PROTECTION,0.0,0.0,AZ: Somerton,1.0
9724,MO: U.S. DRUG ENFORCEMENT ADMINISTRATION,0.0,0.0,MO: Kansas City,1.0
9725,FL: CAPE CORAL POLICE DEPARTMENT,0.0,0.0,FL: Cape Coral,3.0
9728,SD: PINE RIDGE TRIBAL POLICE DEPARTMENT,0.0,0.0,SD: Pine Ridge,1.0
9729,AZ: COLORADO RIVER INDIAN TRIBES POLICE DEPARTMENT,0.0,0.0,AZ: Parker,1.0
9730,OR: TUALATIN POLICE DEPARTMENT,0.0,0.0,OR: Tualatin,1.0
9731,AL: LINCOLN AL POLICE DEPARTMENT,0.0,0.0,AL: Eastaboga,1.0
9732,IL: LANSING POLICE DEPARTMENT,0.0,0.0,IL: Lansing,1.0
9733,FL: SNEADS POLICE DEPARTMENT,0.0,0.0,FL: Sneads,1.0
9734,OR: OREGON CITY POLICE DEPARTMENT,0.0,0.0,OR: Oregon City,1.0
9735,WV: WEIRTON POLICE DEPARTMENT,0.0,0.0,WV: Weirton,1.0
9736,WI: WAUSAU POLICE DEPARTMENT,0.0,0.0,WI: Wasau,1.0
9737,TX: HARRIS COUNTY CONSTABLE PRECINCT 5,0.0,0.0,TX: Houston,1.0
9738,UT: UNIFIED POLICE DEPARTMENT,0.0,0.0,UT: Milcreek,3.0
9741,VA: CHESAPEAKE POLICE DEPARTMENT,0.0,0.0,VA: Chesapeake,2.0
9743,WI: ANTIGO POLICE DEPARTMENT,0.0,0.0,WI: Antigo,1.0
9744,KS: U.S. MARSHALS SERVICE,0.0,0.0,KS: Topeka,2.0
9746,NY: TROY POLICE DEPARTMENT,0.0,0.0,NY: Troy,2.0
9748,CA: LAKE ELSINORE POLICE DEPARTMENT,0.0,0.0,CA: Lake Elsinore,2.0
9750,NY: ROTTERDAM POLICE DEPARTMENT,0.0,0.0,NY: Rotterdam,1.0
9751,NJ: FRANKLIN TOWNSHIP POLICE DEPARTMENT,0.0,0.0,NJ: New Brunswick,1.0
9752,WI: LAKE HALLIE POLICE DEPARTMENT,0.0,0.0,WI: Lake Hallie,1.0
9753,MA: WEST SPRINGFIELD POLICE DEPARTMENT,0.0,0.0,MA: West Springfield,1.0
9754,GA: JACKSON POLICE DEPARTMENT,0.0,0.0,GA: Jackson,1.0
9755,CA: CLEARLAKE POLICE DEPARTMENT,0.0,0.0,CA: Clearlake,1.0
9756,MA: LOWELL POLICE DEPARTMENT,0.0,0.0,MA: Lowell,1.0
9757,NM: PUEBLO OF LAGUNA POLICE DEPARTMENT,0.0,0.0,NM: Albuquerque,1.0
9758,VA: FREDERICKSBURG POLICE DEPARTMENT,0.0,0.0,VA: Fredericksburg,1.0
9759,CT: STAMFORD POLICE DEPARTMENT,0.0,0.0,CT: Stamford,1.0
9760,IL: PARK FOREST POLICE DEPARTMENT,0.0,0.0,IL: Park Forest,2.0
9762,IL: CLINTON POLICE DEPARTMENT,0.0,0.0,IL: Clinton,1.0
9763,CO: COLORADO STATE TROOPER,0.0,0.0,CO: Colorado City,1.0
9764,NY: CHEEKTOWAGA POLICE DEPARTMENT,0.0,0.0,NY: Buffalo,1.0
9765,PA: JOHNSTOWN POLICE DEPARTMENT,0.0,0.0,PA: Johnstown,1.0
9766,MS: GAUTIER POLICE DEPARTMENT,0.0,0.0,MS: Gautier,1.0
9767,TX: EULISS POLICE DEPARTMENT,0.0,0.0,TX: Euless,1.0
9768,VA: ROANOKE COUNTY POLICE DEPARTMENT,0.0,0.0,VA: Cave Spring,1.0
9769,CO: EVANS POLICE DEPARTMENT,0.0,0.0,CO: Evans,2.0
9771,CT: CONNECTICUT STATE POLICE,0.0,0.0,CT: West Haven,1.0
9781,GA: COMMERCE POLICE DEPARTMENT,0.0,0.0,GA: Commerce,1.0
9782,AR: MENA POLICE DEPARTMENT,0.0,0.0,AR: Mena,1.0
9783,IA: URBANDALE POLICE DEPARTMENT,0.0,0.0,IA: Urbandale,1.0
9784,TX: U.S. MARSHALS SERVICE,0.0,0.0,TX: Fort Worth,1.0
9794,GA: RIVERDALE POLICE DEPARTMENT,0.0,0.0,GA: Riverdale,1.0
9795,NC: MAIDEN POLICE DEPARTMENT,0.0,0.0,NC: Maiden,1.0
9796,AK: NORTH SLOPE BOROUGH POLICE DEPARTMENT,0.0,0.0,AK: Barrow,1.0
9797,KY: U.S. MARSHALS SERVICE,0.0,0.0,KY: Louisville,1.0
9799,MN: ROSEVILLE POLICE DEPARTMENT,0.0,0.0,MN: Roseville,1.0
9801,NY: COLONIE POLICE DEPARTMENT,0.0,0.0,NY: Latham,2.0
9803,OH: KENTON POLICE DEPARTMENT,0.0,0.0,OH: Kenton,1.0
9804,LA: ADDIS POLICE DEPARTMENT,0.0,0.0,LA: Addis,1.0
9805,SD: ROSEBUD SIOUX TRIBE LAW ENFORCEMENT SERVICES,0.0,0.0,SD: Rosebud,1.0
9806,PA: PORT AUTHORITY POLICE,0.0,0.0,PA: Pittsburgh,1.0
9807,TX: SAGINAW POLICE DEPARTMENT,0.0,0.0,TX: Fort Worth,1.0
9808,AR: MOUNTAIN PINE POLICE DEPARTMENT,0.0,0.0,AR: Mountain Pine,1.0
9809,GA: GEORGIA DEPARTMENT OF PUBLIC SAFETY,0.0,0.0,GA: Marietta,1.0
9810,OR: FEDERAL BUREAU OF INVESTIGATION,0.0,0.0,OR: Seneca,1.0
9811,CA: UNION CITY POLICE DEPARTMENT,0.0,0.0,CA: Union City,4.0
9815,OR: MEDFORD POLICE DEPARTMENT,0.0,0.0,OR: Medford,4.0
9819,FL: DEPARTMENT OF HOMELAND SECURITY,0.0,0.0,FL: Jacksonville,1.0
9820,MI: FEDERAL BUREAU OF INVESTIGATION,0.0,0.0,MI: Southfield,1.0
9821,WA: CLE ELUM POLICE DEPARTMENT,0.0,0.0,WA: Cle Elum,1.0
9822,PA: PENNSYLVANIA STATE CONSTABLE,0.0,0.0,PA: Duncannon,1.0
9824,WI: TOWN OF GENEVA POLICE DEPARTMENT,0.0,0.0,WI: Lake Geneva,1.0
9825,IL: ZION POLICE DEPARTMENT,0.0,0.0,IL: Zion,2.0
9827,PA: UPPER DARBY POLICE DEPARTMENT,0.0,0.0,PA: Upper Darby,2.0
9829,MT: LIVINGSTON POLICE DEPARTMENT,0.0,0.0,MT: Livingston,1.0
9830,TX: SWEETWATER POLICE OFFICER,0.0,0.0,TX: Sweetwater,1.0
9831,WY: RAWLINS POLICE DEPARTMENT,0.0,0.0,WY: Rawlins,1.0
9832,VA: SUFFOLK POLICE DEPARTMENT,0.0,0.0,VA: Suffolk,1.0
9833,CA: PALO ALTO POLICE DEPARTMENT,0.0,0.0,CA: Palo Alto,1.0
9834,CA: PORTERVILLE POLICE DEPARTMENT,0.0,0.0,CA: Porterville,1.0
9835,MI: LANSING POLICE DEPARTMENT,0.0,0.0,MI: Lansing,1.0
9836,NH: MASSACHUSETTS STATE POLICE DEPARTMENT,0.0,0.0,NH: Danvers,1.0
9837,TX: UNIVERSITY OF NORTH TEXAS POLICE DEPARTMENT,0.0,0.0,TX: Denton,1.0
9838,OK: HEALDTON POLICE DEPARTMENT,0.0,0.0,OK: Healdton,1.0
9839,PA: STROUD AREA REGIONAL POLICE,0.0,0.0,PA: East Stroudsburg,1.0
9840,CA: MARINA POLICE DEPARTMENT,0.0,0.0,CA: Marina,1.0
9841,OK: SPORTSMEN ACRES POLICE DEPARTMENT,0.0,0.0,OK: Sportsmen Acres,1.0
9842,OH: RICHMOND HEIGHTS POLICE DEPARTMENT,0.0,0.0,OH: Richmond Heights,1.0
9843,ME: BANGOR POLICE DEPARTMENT,0.0,0.0,ME: Bangor,1.0
9844,TX: JAL POLICE DEPARTMENT,0.0,0.0,TX: Wink,1.0
9845,TX: SEAGOVILLE POLICE DEPARTMENT,0.0,0.0,TX: Seagoville,1.0
9846,CA: PARADISE POLICE DEPARTMENT,0.0,0.0,CA: Paradise,2.0
9848,OK: COLBERT POLICE DEPARTMENT,0.0,0.0,OK: Colbert,1.0
9849,IN: HAMMOND POLICE DEPARTMENT,0.0,0.0,IN: Portage,2.0
9851,FL: OPA-LOCKA POLICE DEPARTMENT,0.0,0.0,FL: Opa-locka,1.0
9852,NJ: LITTLE EGG HARBOR POLICE DEPARTMENT,0.0,0.0,NJ: Little Egg Harbor Township,1.0
9853,PA: PHILADELPHIA HOUSING AUTHORITY POLICE DEPARTMENT,0.0,0.0,PA: Philadelphia,1.0
9854,DC: BALTIMORE COUNTY POLICE DEPARTMENT,0.0,0.0,DC: Washington,1.0
9855,SC: SPARTANBURG METHODIST COLLEGE CAMPUS SAFETY DEPARTMENT,0.0,0.0,SC: Spartanburg,1.0
9856,NV: CLARK COUNTY SCHOOL DISTRICT POLICE DEPARTMENT,0.0,0.0,NV: Las Vegas,1.0
9857,FL: DELAND POLICE DEPARTMENT,0.0,0.0,FL: Deltona,1.0
9861,OK: SKIATOOK POLICE DEPARTMENT,0.0,0.0,OK: Hominy,1.0
9862,CA: UNIVERSITY OF CALIFORNIA POLICE DEPARTMENT,0.0,0.0,CA: Merced,1.0
9863,LA: AVOYELLES PARISH WARD 2,0.0,0.0,LA: Marksville,1.0
9864,AL: OPELIKA POLICE DEPARTMENT,0.0,0.0,AL: Opelika,1.0
9865,OR: UNKNOWN,0.0,0.0,OR: Forest Grove,1.0
9866,CA: SAN DIEGO HARBOR POLICE DEPARTMENT,0.0,0.0,CA: San Diego,1.0
9867,PA: SOUTHEASTERN PENNSYLVANIA TRANSPORTATION AUTHORITY POLICE DEPARTMENT,0.0,0.0,PA: Philadelphia,1.0
9868,NY: NEW PALTZ POLICE DEPARTMENT,0.0,0.0,NY: New Paltz,1.0
9869,OK: MIDWEST CITY POLICE DEPARTMENT,0.0,0.0,OK: Midwest City,3.0
9872,CA: US CUSTOMS AND BORDER PROTECTION,0.0,0.0,CA: Calexico,1.0
9873,FL: PALM BEACH GARDENS POLICE DEPARTMENT,0.0,0.0,FL: Palm Beach,2.0
9875,PA: YORK POLICE DEPARTMENT,0.0,0.0,PA: York,1.0
9876,CA: U.S. IMMIGRATION AND CUSTOMS ENFORCEMENT,0.0,0.0,CA: Chula Vista,1.0
9877,GA: EMERSON POLICE DEPARTMENT,0.0,0.0,GA: Catersville,1.0
9878,CA: SEASIDE POLICE DEPARTMENT,0.0,0.0,CA: Seaside,2.0
9880,MA: BEVERLY POLICE DEPARTMENT,0.0,0.0,MA: Beverly,1.0
9881,CA: MONTEREY POLICE DEPARTMENT,0.0,0.0,CA: Monterey,1.0
9882,NJ: WOODBRIDGE POLICE DEPARTMENT,0.0,0.0,NJ: Woodbridge Township,1.0
9883,TX: HURST POLICE DEPARTMENT,0.0,0.0,TX: Hurst,1.0
9884,TX: ROCKPORT POLICE DEPARTMENT,0.0,0.0,TX: Rockport,1.0
9885,NM: LOVINGTON POLICE DEPARTMENT,0.0,0.0,NM: Lovington,1.0
9886,TX: MCKINNEY POLICE DEPARTMENT,0.0,0.0,TX: McKinney,1.0
9887,CA: SAND CITY POLICE DEPARTMENT,0.0,0.0,CA: Sand City,2.0
9889,KY: UNKNOWN,0.0,0.0,KY: Eddyville,1.0
9890,PA: FEDERAL BUREAU OF INVESTIGATION,0.0,0.0,PA: Chester,1.0
9891,NY: POTSDAM POLICE DEPARTMENT,0.0,0.0,NY: Potsdam,1.0
9892,WI: ASHWAUBENON DEPARTMENT OF PUBLIC SAFETY,0.0,0.0,WI: Green Bay,1.0
9893,TN: PARIS POLICE DEPARTMENT,0.0,0.0,TN: Puryear,1.0
9894,MI: LATHRUP VILLAGE POLICE DEPARTMENT,0.0,0.0,MI: Detroit,1.0
9895,CA: HOOPA TRIBAL POLICE,0.0,0.0,CA: Weitchpec,1.0
9896,SD: MITCHELL POLICE DIVISION,0.0,0.0,SD: Mitchell,1.0
9897,NH: MERRIMACK POLICE DEPARTMENT,0.0,0.0,NH: Merrimack,1.0
9898,OH: TWINSBURG POLICE DEPARTMENT,0.0,0.0,OH: Twinsburg,1.0
9899,WV: BLUEFIELD POLICE DEPARTMENT,0.0,0.0,WV: Bluefield,1.0
9900,OK: CUSHING POLICE DEPARTMENT,0.0,0.0,OK: Cushing,2.0
9902,UT: SPANISH FORK POLICE DEPARTMENT,0.0,0.0,UT: Spanish Fork,1.0
9903,NC: ARCHDALE POLICE DEPARTMENT,0.0,0.0,NC: Archdale,1.0
9904,PA: PITTSTON POLICE DEPARTMENT,0.0,0.0,PA: Pittston,1.0
9905,OK: ARDMORE POLICE DEPARTMENT,0.0,0.0,OK: Ardmore,2.0
9907,NC: GASTON COUNTY POLICE DEPARTMENT,0.0,0.0,NC: Gastonia,2.0
9909,TX: BROOKSHIRE POLICE DEPARTMENT,0.0,0.0,TX: Brookshire,2.0
9911,KY: ELSMERE POLICE DEPARTMENT,0.0,0.0,KY: Elsmere,1.0
9912,IL: CHAMPAIGN POLICE DEPARTMENT,0.0,0.0,IL: Rantoul,1.0
9913,PA: SOUTH LONDONDERRY POLICE DEPARTMENT,0.0,0.0,PA: Palmyra,1.0
9914,WV: NITRO POLICE DEPARTMENT,0.0,0.0,WV: Nitro,1.0
9915,LA: U.S. MARSHALS SERVICE,0.0,0.0,LA: Baton Rouge,1.0
9916,UT: LOGAN POLICE DEPARTMENT,0.0,0.0,UT: Logan,1.0
9917,MN: PLYMOUTH POLICE DEPARTMENT,0.0,0.0,MN: Plymouth,1.0
9918,OH: UNIVERSITY OF CINCINNATI POLICE DEPARTMENT,0.0,0.0,OH: Cincinnati,1.0
9919,CA: FARMERSVILLE POLICE DEPARTMENT,0.0,0.0,CA: Farmersville,1.0
9920,FL: HOMESTEAD POLICE DEPARTMENT,0.0,0.0,FL: Homestead,2.0
9922,AL: OPP POLICE DEPARTMENT,0.0,0.0,AL: Opp,1.0
9923,CA: MORENO VALLEY POLICE DEPARTMENT,0.0,0.0,CA: Moreno Valley,2.0
9925,FL: PLANTATION POLICE DEPARTMENT,0.0,0.0,FL: Plantation,1.0
9927,UT: PAROWAN POLICE DEPARTMENT,0.0,0.0,UT: Parowan,1.0
9928,MS: STONEWALL POLICE DEPARTMENT,0.0,0.0,MS: Stonewall,1.0
9929,KY: ELIZABETHTOWN POLICE DEPARTMENT,0.0,0.0,KY: Elizabethtown,2.0
9931,UT: UTAH STATE HIGHWAY PATROL,0.0,0.0,UT: Ogden,1.0
9932,NH: HAVERHILL POLICE DEPARTMENT,0.0,0.0,NH: Bath,1.0
9933,WV: WEST VIRGINIA STATE POLICE DEPARTMENT,0.0,0.0,WV: Meadow Bridge,10.0
9943,WV: WESTON POLICE DEPARTMENT,0.0,0.0,WV: Weston,1.0
9944,NC: FRANKLIN POLICE DEPARTMENT,0.0,0.0,NC: Franklin,1.0
9945,NY: FEDERAL LAW ENFORCEMENT AGENTS,0.0,0.0,NY: Malone,1.0
9946,MA: MASSACHUSETTS STATE POLICE DEPARTMENT,0.0,0.0,MA: Boston,1.0
9952,NJ: NEPTUNE POLICE DEPARTMENT,0.0,0.0,NJ: Asbury Park,1.0
9953,ND: SPIRIT LAKE TRIBAL POLICE DEPARTMENT,0.0,0.0,ND: Fort Totten,1.0
9954,IN: KOKOMO POLICE DEPARTMENT,0.0,0.0,IN: Kokomo,1.0
9955,OH: FINDLAY POLICE DEPARTMENT,0.0,0.0,OH: Findlay,1.0
9956,WA: WOODLAND POLICE DEPARTMENT,0.0,0.0,WA: Woodland,1.0
9957,FL: MELBOURNE POLICE DEPARTMENT,0.0,0.0,FL: Melbourne,1.0
9958,FL: NORTH PORT POLICE DEPARTMENT,0.0,0.0,FL: North Port,2.0
9960,NJ: BYRAM POLICE DEPARTMENT,0.0,0.0,NJ: Byram Township,1.0
9961,NJ: LYNDHURST POLICE DEPARTMENT,0.0,0.0,NJ: Lyndhurst,1.0
9963,KY: LOUISA POLICE DEPARTMENT,0.0,0.0,KY: Louisa,1.0
9964,GA: CARROLTON POLICE DEPARTMENT,0.0,0.0,GA: Carrollton,1.0
9965,MI: TRENTON POLICE DEPARTMENT,0.0,0.0,MI: Trenton,1.0
9966,NJ: MONMOUTH COUNTY EMERGENCY RESPONSE TEAM,0.0,0.0,NJ: Middletown,1.0
9967,LA: FEDERAL BUREAU OF INVESTIGATION,0.0,0.0,LA: Bossier City,2.0
9969,PA: PENNSYLVANIA STATE POLICE DEPARTMENT,0.0,0.0,PA: Somerset,14.0
9983,SC: SOUTH CAROLINA STATE LAW ENFORCEMENT DIVISION,0.0,0.0,SC: Charleston,1.0
9984,IL: HARVEY POLICE DEPARTMENT,0.0,0.0,IL: Harvey,2.0
9986,HI: U.S. MARSHALS SERVICE,0.0,0.0,HI: Honolulu,1.0
9987,NY: BEACON POLICE DEPARTMENT,0.0,0.0,NY: Beacon,1.0
9988,VA: PULASKI POLICE DEPARTMENT,0.0,0.0,VA: Pulaski,1.0
9989,WA: KENNEWICK POLICE DEPARTMENT/TRI-CITY SWAT TEAM,0.0,0.0,WA: Kennewick,1.0
9990,UT: ROOSEVELT POLICE DEPARTMENT,0.0,0.0,UT: Roosevelt,1.0
9991,KY: KENTUCKY STATE POLICE DEPARTMENT,0.0,0.0,KY: Chavies,11.0
10002,CA: CALIFORNIA DEPARTMENT OF FISH AND WILDLIFE,0.0,0.0,CA: Elk Grove,1.0
10004,MI: U.S. IMMIGRATION AND CUSTOMS ENFORCEMENT,0.0,0.0,MI: Detroit,1.0
10005,CA: FOUNTAIN VALLEY POLICE DEPARTMENT,0.0,0.0,CA: Garden Grove,1.0
10006,OK: OKLAHOMA DEPARTMENT OF WILDLIFE CONSERVATION,0.0,0.0,OK: Bunch,1.0
10007,NE: SIDNEY POLICE DEPARTMENT,0.0,0.0,NE: Sidney,1.0
10008,FL: PANAMA CITY POLICE DEPARTMENT,0.0,0.0,FL: Panama City,1.0
10009,MD: HAGERSTOWN POLICE DEPARTMENT,0.0,0.0,MD: Hagerstown,1.0
10010,CA: SHAFTER POLICE DEPARTMENT,0.0,0.0,CA: Shafter,1.0
10011,MI: GIBRALTAR POLICE DEPARTMENT,0.0,0.0,MI: Rockwood,1.0
10012,CO: CARSON CITY POLICE DEPARTMENT,0.0,0.0,CO: Carson City,1.0
10013,MO: AFFTON POLICE DEPARTMENT,0.0,0.0,MO: Affton,1.0
10014,ID: BONNEVILLE COUNTY,0.0,0.0,ID: Rigby,1.0
10015,WA: U.S. FOREST SERVICE,0.0,0.0,WA: Tonasket,1.0
10016,OK: WARNER POLICE DEPARTMENT,0.0,0.0,OK: Muskogee County,1.0
10017,IL: ROCK ISLAND POLICE DEPARTMENT,0.0,0.0,IL: Rock Island,1.0
10018,NY: CITY OF ALBANY POLICE DEPARTMENT,0.0,0.0,NY: Albany,1.0
10019,NJ: HAMILTON POLICE DEPARTMENT,0.0,0.0,NJ: Hamilton Township,2.0
10021,MD: NATIONAL SECURITY ADMINISTRATION POLICE DEPARTMENT,0.0,0.0,MD: Fort George Meade,1.0
10022,VA: CULPEPER POLICE DEPARTMENT,0.0,0.0,VA: Culpeper,1.0
10023,NV: BOULDER CITY POLICE DEPARTMENT,0.0,0.0,NV: Boulder City,1.0
10024,CA: ENCINITAS POLICE DEPARTMENT,0.0,0.0,CA: Encinitas,1.0
10025,MA: WEBSTER POLICE DEPARTMENT,0.0,0.0,MA: Webster,1.0
10026,KS: GARDNER POLICE DEPARTMENT,0.0,0.0,KS: Gardner,1.0
10027,WI: WISCONSIN STATE POLICE,0.0,0.0,WI: Fond du Lac,1.0
10028,AZ: NAVAJO NATION POLICE DEPARTMENT,0.0,0.0,AZ: Lukachukai,1.0
10029,LA: JEFFERSON PARISH POLICE DEPARTMENT,0.0,0.0,LA: Kenner,1.0
10030,WA: U.S. BORDER PATROL,0.0,0.0,WA: Sumas,1.0
