,stStation,Quantity,Acquisition Value,city_name,deaths
3650,MS: RIDGELAND POLICE DEPARTMENT,55.0,41195.0,MS: Ridgeland,1.0
3657,MT: GREAT FALLS POLICE DEPARTMENT,327.0,859291.9499999997,MT: Great Falls,3.0
3700,NC: ENFIELD POLICE DEPARTMENT,1.0,41447.0,NC: Enfield,1.0
3702,NC: FAYETTEVILLE POLICE DEPARTMENT,31.0,862000.0,NC: Fayetteville,8.0
3720,NC: HOPE MILLS POLICE DEPARTMENT,315.0,230358.42999999996,NC: Hope Mills,2.0
3726,NC: KENLY POLICE DEPARTMENT,23.0,22299.16,NC: Selma,1.0
3730,NC: LENOIR POLICE DEPARTMENT,1.0,658000.0,NC: Lenoir,1.0
3766,NC: WAKE FOREST POLICE DEPARTMENT,1.0,658000.0,NC: Wake Forest,2.0
3778,ND: BISMARCK POLICE DEPARTMENT,33.0,618725.0,ND: Bismarck,1.0
3786,ND: DICKINSON POLICE DEPARTMENT,3.0,377121.0,ND: Dickinson,1.0
3794,ND: GRAND FORKS POLICE DEPARTMENT,69.0,57214.45999999999,ND: Grand Forks,1.0
3830,NE: BELLEVUE POLICE DEPARTMENT,1.0,658000.0,NE: Bellevue,3.0
3850,NE: SOUTH SIOUX CITY POLICE DEPARTMENT,1025.0,23913.300000000007,NE: South Sioux City,1.0
3899,NJ: ATLANTIC CITY POLICE DEPARTMENT,1390.0,858806.5599999997,NJ: Atlantic City,5.0
3912,NJ: BELLEVILLE POLICE DEPARTMENT,33.0,76464.0,NJ: Belleville,1.0
3925,NJ: BRICK TOWNSHIP POLICE DEPARTMENT,11.0,1449988.88,NJ: Brick,2.0
3966,NJ: HACKENSACK POLICE DEPARTMENT,1321.0,320539.68000000005,NJ: Hackensack,2.0
4008,NJ: MILLVILLE POLICE DEPARTMENT,20.0,14980.0,NJ: Millville,1.0
4033,NJ: PARAMUS POLICE DEPARTMENT,654.0,845895.62,NJ: Bergen,1.0
4036,NJ: PASSAIC POLICE DEPARTMENT,67.0,82132.0,NJ: Passaic,2.0
4040,NJ: PERTH AMBOY POLICE DEPARTMENT,1915.0,2090545.33,NJ: Perth Amboy,1.0
4041,NJ: PHILLIPSBURG POLICE DEPARTMENT,5.0,0.0,NJ: Phillipsburg,1.0
4075,NJ: TOMS RIVER POLICE DEPARTMENT,39.0,972704.95,NJ: Toms River,1.0
4104,NM: ALAMOGORDO POLICE DEPARTMENT,63.0,486999.0,NM: Alamogordo,1.0
4105,NM: ALBUQUERQUE POLICE DEPARTMENT,205.0,746277.76,NM: Albuquerque,2.0
4166,NM: BLOOMFIELD POLICE DEPARTMENT,2.0,41556.0,NM: Bloomfield,1.0
4167,NM: CARLSBAD POLICE DEPARTMENT,28.0,743030.7,NM: Carlsbad,1.0
4179,NM: CLOVIS POLICE DEPARTMENT,1.0,412000.0,NM: Clovis,1.0
4181,NM: DEMING POLICE DEPARTMENT,1.0,733000.0,NM: Deming,1.0
4189,NM: HOBBS POLICE DEPARTMENT,1.0,733000.0,NM: Hobbs,1.0
4195,NM: LAS CRUCES POLICE DEPARTMENT,1.0,10000.0,NM: Las Cruces,11.0
4221,NM: RIO RANCHO POLICE DEPARTMENT,7.0,804897.0,NM: Albuquerque,1.0
4222,NM: ROSWELL POLICE DEPARTMENT,2.0,796894.0,NM: Roswell,3.0
4225,NM: RUIDOSO POLICE DEPARTMENT,22.0,82457.0,NM: Ruidoso,3.0
4233,NM: SANTA FE POLICE DEPARTMENT,34.0,740577.76,NM: Santa Fe,3.0
4238,NM: SILVER CITY POLICE DEPARTMENT,1.0,65070.0,NM: Silver City,1.0
4250,NV: ELKO POLICE DEPARTMENT,140.0,829205.0599999999,NV: Elko,1.0
4257,NV: RENO POLICE DEPARTMENT,2.0,200123.73,NV: Reno,1.0
4281,NV: SPARKS POLICE DEPARTMENT,150.0,1556651.2900000003,NV: Sparks,6.0
4288,NV: WEST WENDOVER POLICE DEPARTMENT,1.0,47023.0,NV: West Wendover (Wendover),1.0
4292,NY: ALBANY POLICE DEPARTMENT,1.0,89900.0,NY: Utica,2.0
4330,NY: JOHNSON CITY POLICE DEPARTMENT,18.0,335.0,NY: Johnson City,1.0
4346,NY: NASSAU COUNTY POLICE DEPARTMENT,18.0,1545002.88,NY: Oceanside,4.0
4373,NY: POUGHKEEPSIE POLICE DEPARTMENT,5.0,733552.0,NY: Poughkeepsie,1.0
4376,NY: ROCHESTER POLICE DEPARTMENT,19.0,710339.0,NY: Rochester,3.0
4392,NY: SUFFOLK COUNTY POLICE DEPARTMENT,2396.0,1531759.0799999994,NY: Brentwood,6.0
4400,NY: SYRACUSE POLICE DEPARTMENT,1.0,658000.0,NY: Syracuse,5.0
4423,OH: ASHTABULA POLICE DEPARTMENT,365.0,849214.07,OH: Ashtabula,1.0
4428,OH: BARBERTON POLICE DEPARTMENT,1.0,733000.0,OH: Barberton,1.0
4429,OH: BEAVERCREEK POLICE DEPARTMENT,1.0,733000.0,OH: Beavercreek,1.0
4431,OH: BEDFORD POLICE DEPARTMENT,15.0,55287.0,OH: Bedford,1.0
4452,OH: CANTON POLICE DEPARTMENT,14.0,826920.0,OH: Canton,1.0
4454,OH: CELINA POLICE DEPARTMENT,1199.0,395824.03,OH: Celina,1.0
4459,OH: CLEVELAND METROPARKS RANGER DEPARTMENT,21.0,20181.0,OH: Cleveland,1.0
4477,OH: EAST CLEVELAND POLICE DEPARTMENT,1.0,41061.0,OH: Cleveland,1.0
4483,OH: ENGLEWOOD POLICE DEPARTMENT,18.0,2160.0,OH: Englewood,1.0
4484,OH: EUCLID POLICE DEPARTMENT,94.0,348.69,OH: Euclid,1.0
4485,OH: FAIRBORN POLICE DEPARTMENT,13.0,670.0,OH: Fairborn,1.0
4497,OH: GENEVA ON THE LAKE POLICE DEPARTMENT,4.0,60456.0,OH: Cleveland,1.0
4508,OH: HAMILTON POLICE DEPARTMENT,12.0,5988.0,OH: Hamilton,3.0
4517,OH: HUBER HEIGHTS POLICE DEPARTMENT,40.0,4800.0,OH: Huber Heights,1.0
4528,OH: LANCASTER POLICE DEPARTMENT,139.0,324433.45999999996,OH: Lancaster,1.0
4540,OH: LORAIN POLICE DEPARTMENT,17.0,742703.99,OH: Lorain,1.0
4559,OH: MIDDLEFIELD POLICE DEPARTMENT,5.0,90235.0,OH: Middlefield,1.0
4573,OH: NILES POLICE DEPARTMENT,155.0,751826.59,OH: Niles,1.0
4627,OH: SPRINGFIELD POLICE DEPARTMENT,63.0,1839.31,OH: Akron,1.0
4646,OH: UNIONTOWN POLICE DEPARTMENT,6.0,397.86,OH: Uniontown,1.0
4668,OK: ADA POLICE DEPARTMENT,27.0,13473.0,OK: Ada,2.0
4672,OK: BARTLESVILLE POLICE DEPARTMENT,136.0,1030802.43,OK: Bartlesville,3.0
4679,OK: BETHANY POLICE DEPARTMENT,23.0,10755.0,OK: Bethany,1.0
4680,OK: BIXBY POLICE DEPARTMENT,1.0,733000.0,OK: Bixby,1.0
4687,OK: CACHE POLICE DEPARTMENT,11.0,51266.84,OK: Cache,1.0
4699,OK: CHICKASHA POLICE DEPARTMENT,16.0,6226.0,OK: Chickasha,1.0
4704,OK: CHOCTAW POLICE DEPARTMENT,8.0,51298.0,OK: Grant,1.0
4717,OK: DEL CITY POLICE DEPARTMENT,3.0,618.0,OK: Del City,1.0
4726,OK: ENID POLICE DEPARTMENT,16.0,696485.0,OK: Enid,3.0
4736,OK: GUTHRIE POLICE DEPARTMENT,49.0,751342.0,OK: Guthrie,1.0
4754,OK: MOORE POLICE DEPARTMENT,20.0,735334.0,OK: Moore,1.0
4757,OK: MUSKOGEE POLICE DEPARTMENT,116.0,779377.7499999994,OK: Muskogee,3.0
4770,OK: OWASSO POLICE DEPARTMENT,17.0,84772.0,OK: Owasso,1.0
4777,OK: PONCA CITY POLICE DEPARTMENT,15.0,335.0,OK: Ponca City,1.0
4783,OK: RUSH SPRINGS POLICE DEPARTMENT,5.0,1051.0,OK: Rush Springs,1.0
4784,OK: SAND SPRINGS POLICE DEPARTMENT,6.0,720.0,OK: Sapulpa,2.0
4796,OK: TAHLEQUAH POLICE DEPARTMENT,27.0,3276.0,OK: Tahlequah,3.0
4803,OK: TULSA POLICE DEPARTMENT,1.0,733000.0,OK: Tulsa,1.0
4858,OK: WARR ACRES POLICE DEPARTMENT,10.0,4990.0,OK: Oklahoma City,1.0
4863,OK: WETUMKA POLICE DEPARTMENT,7.0,43333.0,OK: Wetumka,1.0
4879,OR: EUGENE POLICE DEPARTMENT,29.0,339686.93,OR: Eugene,5.0
4885,OR: GRANTS PASS DEPARTMENT OF PUBLIC SAFETY,321.0,1236251.73,OR: Grants Pass,1.0
4889,OR: KLAMATH FALLS POLICE DEPARTMENT,61.0,93274.28,OR: Chiloquin,3.0
4900,OR: SALEM POLICE DEPARTMENT,44.0,960.0,OR: Salem,4.0
4904,OR: SPRINGFIELD POLICE DEPARTMENT,481.0,379986.2400000001,OR: Springfield,2.0
4911,PA: ABINGTON TOWNSHIP POLICE DEPARTMENT,184.0,807079.5399999999,PA: Elkins Park,1.0
4923,PA: CARBONDALE POLICE DEPARTMENT,25.0,13.69,PA: Carbondale,1.0
4927,PA: CHESTER POLICE DEPARTMENT,33.0,122579.9,PA: Chester,2.0
4957,PA: LOWER PAXTON TOWNSHIP POLICE DEPARTMENT,766.0,136772.94999999998,PA: Paxtonia,1.0
4969,PA: NEW CASTLE POLICE DEPARTMENT,2250.0,1353062.63,PA: New Castle,1.0
4980,PA: OIL CITY POLICE DEPARTMENT,1.0,65070.0,PA: Oil CIty,1.0
4985,PA: POTTSTOWN POLICE DEPARTMENT,121.0,733926.96,PA: Pottstown,1.0
5033,SC: ANDERSON POLICE DEPARTMENT,1.0,41061.0,SC: Anderson,3.0
5047,SC: CAYCE DEPARTMENT OF PUBLIC SAFETY,23.0,136538.19999999995,SC: Cayce,1.0
5050,SC: CHARLESTON POLICE DEPARTMENT,27.0,670924.69,SC: Charleston,1.0
5059,SC: COLUMBIA POLICE DEPARTMENT,310.0,1562722.7799999982,SC: Columbia,1.0
5072,SC: FLORENCE POLICE DEPARTMENT,154.0,429837.47000000055,SC: Florence,2.0
5076,SC: FOUNTAIN INN POLICE DEPARTMENT,46.0,733.69,SC: Fountain Inn,1.0
5086,SC: HANAHAN POLICE DEPARTMENT,1.0,118791.0,SC: Charleston,1.0
5089,SC: HORRY COUNTY POLICE DEPARTMENT,310.0,834854.05,SC: Nichols,3.0
5115,SC: MYRTLE BEACH POLICE DEPARTMENT,5407.0,1832971.959999999,SC: Myrtle Beach,4.0
5138,SC: SENECA POLICE DEPARTMENT,38.0,375600.68,SC: Seneca,1.0
5145,SC: SUMTER POLICE DEPARTMENT,911.0,71720.33000000003,SC: Sumter,1.0
5150,SC: WEST COLUMBIA POLICE DEPARTMENT,70.0,32.84,SC: West Columbia,1.0
5181,SD: RAPID CITY POLICE DEPARTMENT,153.0,298028.56999999995,SD: Rapid City,7.0
5188,SD: SIOUX FALLS POLICE DEPARTMENT,1.0,77000.0,SD: Sioux Falls,2.0
5210,TN: BRISTOL POLICE DEPARTMENT,86.0,762082.21,TN: Bristol,2.0
5219,TN: CARTHAGE POLICE DEPARTMENT,8.0,12.26,TN: Carthage,1.0
5226,TN: CLINTON POLICE DEPARTMENT,32.0,10240.0,TN: Clinton,1.0
5230,TN: COLUMBIA POLICE DEPARTMENT,248.0,865951.8999999999,TN: Columbia,1.0
5244,TN: DICKSON POLICE DEPARTMENT,27.0,893991.3,TN: Bon Aqua,1.0
5250,TN: EAST RIDGE POLICE DEPARTMENT,3.0,740122.0,TN: Chattanooga,1.0
5254,TN: FAIRVIEW POLICE DEPARTMENT,245.0,856002.98,TN: Fairview,2.0
5264,TN: GREENEVILLE POLICE DEPARTMENT,27.0,1293280.57,TN: Greeneville,2.0
5273,TN: HENDERSONVILLE POLICE DEPARTMENT,292.0,1344588.72,TN: Hendersonville,1.0
5283,TN: JACKSON POLICE DEPARTMENT,4.0,2411165.0,TN: Jackson,2.0
5288,TN: JONESBOROUGH POLICE DEPARTMENT,148.0,632183.8400000001,TN: Jonesborough,1.0
5292,TN: KNOXVILLE POLICE DEPARTMENT,1.0,60409.0,TN: Knoxville,7.0
5300,TN: LAFOLLETTE POLICE DEPARTMENT,4.0,221785.0,TN: La Follette,1.0
5302,TN: LAWRENCEBURG POLICE DEPARTMENT,9182.0,3657575.4400000004,TN: Lawrenceburg,1.0
5304,TN: LENOIR CITY POLICE DEPARTMENT,281.0,1365037.86,TN: Lenoir City,1.0
5323,TN: MEMPHIS POLICE DEPARTMENT,1.0,658000.0,TN: Memphis,21.0
5345,TN: METROPOLITAN NASHVILLE POLICE DEPARTMENT,68.0,12396.0,TN: Nashville,11.0
5363,TN: MORRISTOWN POLICE DEPARTMENT,113.0,872229.2599999999,TN: Morristown,2.0
5368,TN: MOUNT PLEASANT POLICE DEPARTMENT,184.0,2056704.04,TN: Mount Pleasant,1.0
5374,TN: OAK RIDGE POLICE DEPARTMENT,59.0,689361.0,TN: Oak Ridge,1.0
5384,TN: PIGEON FORGE POLICE DEPARTMENT,1.0,865000.0,TN: Pigeon Forge,2.0
5407,TN: SMYRNA POLICE DEPARTMENT,2.0,82122.0,TN: Smyrna,1.0
5410,TN: SPRING HILL POLICE DEPARTMENT,151.0,206012.57,TN: Spring Hill,1.0
5447,TX: ALLEN POLICE DEPARTMENT,12.0,1077717.0,TX: Allen,2.0
5450,TX: ALVIN POLICE DEPARTMENT,1084.0,2131639.7699999996,TX: Alvin,1.0
5458,TX: AUSTIN POLICE DEPARTMENT,1840.0,1703955.89,TX: Austin,31.0
5489,TX: AZLE POLICE DEPARTMENT,47.0,19759.719999999998,TX: Azle,1.0
5493,TX: BEAUMONT POLICE DEPARTMENT,26.0,12974.0,TX: Beaumont,5.0
5498,TX: BEDFORD POLICE DEPARTMENT,146.0,827424.4400000008,TX: Bedford,1.0
5501,TX: BELLMEAD POLICE DEPARTMENT,2.0,64543.0,TX: Waco,1.0
5508,TX: BOERNE POLICE DEPARTMENT,1.0,733000.0,TX: Boerne,1.0
5515,TX: BROWNSVILLE POLICE DEPARTMENT,65.0,740279.14,TX: Brownsville,6.0
5543,TX: CONROE POLICE DEPARTMENT,187.0,5806.03,TX: Conroe,3.0
5546,TX: COPPERAS COVE POLICE DEPARTMENT,51.0,527.3199999999999,TX: Copperas Cove,1.0
5553,TX: DALHART POLICE DEPARTMENT,6.0,352.26,TX: Dalhart,2.0
5558,TX: DEL RIO POLICE DEPARTMENT,51.0,739000.0,TX: Del Rio,1.0
5562,TX: DESOTO POLICE DEPARTMENT,1.0,733000.0,TX: DeSoto,3.0
5567,TX: DONNA POLICE DEPARTMENT,3.0,123183.0,TX: Donna,1.0
5571,TX: DUNCANVILLE POLICE DEPARTMENT,721.0,784988.5,TX: Dallas,3.0
5581,TX: EDINBURG POLICE DEPARTMENT,97.0,782260.0,TX: Edinburg,2.0
5585,TX: EL PASO POLICE DEPARTMENT,29.0,10670.0,TX: El Paso,15.0
5613,TX: FORT WORTH POLICE DEPARTMENT,2.0,154000.0,TX: Fort Worth,28.0
5644,TX: FREEPORT POLICE DEPARTMENT,3.0,740122.0,TX: Freeport,3.0
5649,TX: FULSHEAR POLICE DEPARTMENT,155.0,96095.34,TX: Katy,1.0
5651,TX: GALVESTON POLICE DEPARTMENT,108.0,751198.77,TX: Galveston,3.0
5658,TX: GRAND PRAIRIE POLICE DEPARTMENT,93.0,63571.759999999995,TX: Cedar Hill,5.0
5674,TX: HARLINGEN POLICE DEPARTMENT,5.0,794584.0,TX: Harlingen,2.0
5679,TX: HARRIS COUNTY CONSTABLE PRECINCT 4,1.0,41061.0,TX: Cypress,1.0
5698,TX: HOUSTON POLICE DEPARTMENT,16001.0,4034447.360000005,TX: Houston,1.0
5848,TX: LA MARQUE POLICE DEPARTMENT,51.0,18151.760000000002,TX: La Marque,1.0
5849,TX: LA PORTE POLICE DEPARTMENT,7.0,150879.24,TX: La Porte,1.0
5853,TX: LEAGUE CITY POLICE DEPARTMENT,224.0,1137515.31,TX: League City,5.0
5861,TX: LITTLE ELM POLICE DEPARTMENT,94.0,1041173.0,TX: Little Elm,1.0
5864,TX: LONGVIEW POLICE DEPARTMENT,248.0,764468.89,TX: Longview,7.0
5888,TX: MIDLOTHIAN POLICE DEPARTMENT,11.0,432620.0,TX: Midlothian,1.0
5891,TX: MISSION POLICE DEPARTMENT,3.0,734930.61,TX: Mission,3.0
5909,TX: NOCONA POLICE DEPARTMENT,341.0,381668.6500000001,TX: Nocona,1.0
5911,TX: ODESSA POLICE DEPARTMENT,105.0,52395.0,TX: Odessa,1.0
5919,TX: PALESTINE POLICE DEPARTMENT,1.0,3932.42,TX: Palestine,1.0
5924,TX: PASADENA POLICE DEPARTMENT,4.0,12400.0,TX: Pasadena,1.0
5928,TX: PEARLAND POLICE DEPARTMENT,11.0,1738059.54,TX: Pearland,3.0
5935,TX: PHARR POLICE DEPARTMENT,47.0,589938.86,TX: Pharr,1.0
5937,TX: PLAINVIEW POLICE DEPARTMENT,1.0,658000.0,TX: Plainview,1.0
5939,TX: PONDER POLICE DEPARTMENT,3.0,40246.0,TX: Ponder,1.0
5940,TX: PORT ARTHUR POLICE DEPARTMENT,2.0,82122.0,TX: Port Arthur,5.0
5948,TX: PRAIRIE VIEW POLICE DEPARTMENT,3.0,10550.0,TX: Houston,1.0
5965,TX: ROUND ROCK POLICE DEPARTMENT,1434.0,104375.39000000001,TX: Round Rock,4.0
5973,TX: SAN ANGELO POLICE DEPARTMENT,1.0,865000.0,TX: San Angelo,4.0
5977,TX: SAN ANTONIO POLICE DEPARTMENT,409.0,714467.3500000013,TX: San Antonio,47.0
6024,TX: SAN BENITO POLICE DEPARTMENT,32.0,796531.0,TX: San Benito,1.0
6027,TX: SAN MARCOS POLICE DEPARTMENT,969.0,2293742.1999999997,TX: San Marcos,1.0
6032,TX: SEGUIN POLICE DEPARTMENT,2.0,240.0,TX: Kingsbury,1.0
6043,TX: SUGAR LAND POLICE DEPARTMENT,51.0,692603.56,TX: Sugar Land,1.0
6045,TX: SULPHUR SPRINGS POLICE DEPARTMENT,41.0,22056.0,TX: Sulphur Springs,1.0
6046,TX: SWEETWATER POLICE DEPARTMENT,2.0,34659.81,TX: Sweetwater,1.0
6053,TX: TEXARKANA POLICE DEPARTMENT,1.0,412000.0,TX: Texarkana,1.0
6076,TX: VICTORIA POLICE DEPARTMENT,74.0,422247.0,TX: Victoria,1.0
6081,TX: WATAUGA POLICE DEPARTMENT,4.0,43145.3,TX: Watauga,3.0
6095,TX: WICHITA FALLS POLICE DEPARTMENT,147.0,419767.52,TX: Wichita Falls,3.0
6107,TX: WYLIE POLICE DEPARTMENT,2.0,783458.0,TX: Farmersville,1.0
6111,UT: CEDAR CITY POLICE DEPARTMENT,1.0,733000.0,UT: Cedar City,1.0
6126,UT: SALT LAKE CITY POLICE DEPARTMENT,2.0,658499.0,UT: Salt Lake City,10.0
6140,UT: SOUTH JORDAN POLICE DEPARTMENT,26.0,676725.0,UT: South Jordan,1.0
6143,UT: SYRACUSE POLICE DEPARTMENT,10.0,4990.0,UT: Clinton,1.0
6177,VA: GRUNDY POLICE DEPARTMENT,18.0,60023.81,VA: Grundy,1.0
6179,VA: HARRISONBURG POLICE DEPARTMENT,20.0,847564.0,VA: Harrisonburg,2.0
6185,VA: JAMES CITY COUNTY POLICE DEPARTMENT,52.0,6456.0,VA: Williamsburg,1.0
6197,VA: NEWPORT NEWS POLICE DEPARTMENT,50.0,15096.0,VA: Newport News,4.0
6210,VA: PORTSMOUTH POLICE DEPARTMENT,186.0,260830.38,VA: Portsmouth,3.0
6242,VA: VIRGINIA BEACH POLICE DEPARTMENT,4.0,994000.0,VA: Virginia Beach,6.0
6270,WA: ABERDEEN POLICE DEPARTMENT,37.0,781519.55,WA: Aberdeen,1.0
6277,WA: BREMERTON POLICE DEPARTMENT,7.0,1014.83,WA: Bremerton,1.0
6279,WA: CENTRALIA POLICE DEPARTMENT,203.0,757090.28,WA: Centralia,3.0
6297,WA: HOQUIAM POLICE DEPARTMENT,35.0,5816.0,WA: Hoquiam,2.0
6302,WA: KIRKLAND POLICE DEPARTMENT,47.0,13141.489999999998,WA: Kirkland,3.0
6308,WA: LACEY POLICE DEPARTMENT,23.0,346.1,WA: Lacey,1.0
6309,WA: LAKEWOOD POLICE DEPARTMENT,33.0,107925.21,WA: Lakewood,3.0
6317,WA: LYNNWOOD POLICE DEPARTMENT,14.0,669182.0,WA: Lynnwood,2.0
6322,WA: MONTESANO POLICE DEPARTMENT,1.0,12000.0,WA: Montesano,1.0
6324,WA: MOSES LAKE POLICE DEPARTMENT,80.0,98972.56,WA: Moses Lake,1.0
6331,WA: PASCO POLICE DEPARTMENT,30.0,9996.99,WA: Pasco,5.0
6352,WA: SPOKANE POLICE DEPARTMENT,80.0,7538.0,WA: Spokane,15.0
6368,WA: SUNNYSIDE POLICE DEPARTMENT,209.0,70353.65,WA: Sunnyside,1.0
6370,WA: TOPPENISH POLICE DEPARTMENT,10.0,335.0,WA: Toppenish,1.0
6373,WA: VANCOUVER POLICE DEPARTMENT,1.0,10000.0,WA: Hazel Dell South,6.0
6384,WA: WALLA WALLA POLICE DEPARTMENT,57.0,781330.5,WA: Walla Walla,1.0
6385,WA: WAPATO POLICE DEPARTMENT,22.0,37396.0,WA: Wapato,1.0
6386,WA: WENATCHEE POLICE DEPARTMENT,1.0,10000.0,WA: Wenatchee,3.0
6394,WI: APPLETON POLICE DEPARTMENT,114.0,881678.52,WI: Appleton,3.0
6419,WI: GREEN BAY POLICE DEPARTMENT,129.0,154037.53000000003,WI: Green Bay,4.0
6424,WI: GREENFIELD POLICE DEPARTMENT,31.0,739654.01,WI: Greenfield,1.0
6436,WI: LA CROSSE POLICE DEPARTMENT,3.0,882402.0,WI: La Crosse,1.0
6440,WI: MADISON POLICE DEPARTMENT,184.0,369690.50000000006,WI: Madison,7.0
6450,WI: MILWAUKEE POLICE DEPARTMENT,1948.0,100351.62999999999,WI: Milwaukee,1.0
6483,WI: NEENAH POLICE DEPARTMENT,1.0,733000.0,WI: Menasha,1.0
6520,WI: WAUKESHA POLICE DEPARTMENT,75.0,970047.88,WI: Waukesha,2.0
6535,WV: CHARLESTON POLICE DEPARTMENT,1611.0,13530.350000000006,WV: Charleston,2.0
6545,WV: MONTGOMERY POLICE DEPARTMENT,97.0,455596.19,WV: Montgomery,1.0
6548,WV: MOUNT HOPE POLICE DEPARTMENT,1.0,41061.0,WV: Mt Hope,1.0
6561,WV: WEST VIRGINIA STATE POLICE,22100.0,4354801.9399999995,WV: Drennen,1.0
6591,WY: CHEYENNE POLICE DEPARTMENT,2.0,1422000.0,WY: Cheyenne,1.0
6602,AZ: GLOBE POLICE DEPARTMENT,0.0,0.0,AZ: Globe,1.0
6603,NE: OMAHA POLICE DEPARTMENT,0.0,0.0,NE: Omaha,15.0
6618,WA: FEDERAL WAY POLICE DEPARTMENT,0.0,0.0,WA: Federal Way,6.0
6624,MO: CHESTERFIELD POLICE DEPARTMENT,0.0,0.0,MO: Chesterfield,1.0
6625,MS: MISSISSIPPI HIGHWAY PATROL,0.0,0.0,MS: Blue Mountain,1.0
6631,MO: FULTON POLICE DEPARTMENT,0.0,0.0,MO: Fulton,1.0
6632,CA: EL CENTRO POLICE DEPARTMENT,0.0,0.0,CA: El Centro,1.0
6634,AK: JUNEAU POLICE DEPARTMENT,0.0,0.0,AK: Juneau,1.0
6635,TN: ELIZABETHTON POLICE DEPARTMENT,0.0,0.0,TN: Elizabethton,3.0
6638,UT: SOUTH OGDEN POLICE DEPARTMENT,0.0,0.0,UT: South Ogden,1.0
6639,MO: SPRINGFIELD POLICE DEPARTMENT,0.0,0.0,MO: Springfield,10.0
6649,OK: OKLAHOMA CITY POLICE DEPARTMENT,0.0,0.0,OK: Oklahoma City,48.0
6697,AZ: PHOENIX POLICE DEPARTMENT,0.0,0.0,AZ: Phoenix,108.0
6805,PA: WILKINSBURG POLICE DEPARTMENT,0.0,0.0,PA: Pittsburgh,1.0
6806,MS: HATTIESBURG POLICE DEPARTMENT,0.0,0.0,MS: Hattiesburg,3.0
6809,NY: ITHACA POLICE DEPARTMENT,0.0,0.0,NY: Ithaca,1.0
6810,IN: EVANSVILLE POLICE DEPARTMENT,0.0,0.0,IN: Evansville,5.0
6815,NC: WINSTON-SALEM POLICE DEPARTMENT,0.0,0.0,NC: Winston-Salem,3.0
6818,CA: DAVIS POLICE DEPARTMENT,0.0,0.0,CA: Davis,1.0
6819,AZ: ARIZONA DEPARTMENT OF PUBLIC SAFETY,0.0,0.0,AZ: Tempe,2.0
6841,NC: U.S. MARSHALS SERVICE,0.0,0.0,NC: Lenoir,2.0
6843,MT: U.S. MARSHALS SERVICE,0.0,0.0,MT: Great Falls,2.0
6845,HI: HONOLULU POLICE DEPARTMENT,0.0,0.0,HI: Kapolei,19.0
6864,MN: MINNEAPOLIS POLICE DEPARTMENT,0.0,0.0,MN: Minneapolis,8.0
6872,OH: AKRON POLICE DEPARTMENT,0.0,0.0,OH: Akron,6.0
6878,MO: ST. LOUIS METROPOLITAN POLICE DEPARTMENT,0.0,0.0,MO: St. Louis,39.0
6917,CA: ORANGE POLICE DEPARTMENT,0.0,0.0,CA: Orange,3.0
6920,WA: RENTON POLICE DEPARTMENT,0.0,0.0,WA: Renton,2.0
6922,AL: OZARK POLICE DEPARTMENT,0.0,0.0,AL: Ozark,2.0
6924,NY: NEW YORK STATE POLICE,0.0,0.0,NY: Arietta,5.0
6938,NJ: JERSEY CITY POLICE DEPARTMENT,0.0,0.0,NJ: Jersey City,8.0
6946,WI: BELOIT POLICE DEPARTMENT,0.0,0.0,WI: Beloit,2.0
6948,PA: PENNSYLVANIA STATE POLICE,0.0,0.0,PA: Elkland,2.0
7000,OR: PORTLAND POLICE BUREAU,0.0,0.0,OR: Portland,18.0
7018,AR: FAYETTEVILLE POLICE DEPARTMENT,0.0,0.0,AR: Fayetteville,2.0
7020,MO: KANSAS CITY POLICE DEPARTMENT,0.0,0.0,MO: Kansas City,28.0
7048,TX: TEMPLE POLICE DEPARTMENT,0.0,0.0,TX: Temple,4.0
7052,FL: DAYTONA BEACH POLICE DEPARTMENT,0.0,0.0,FL: Daytona Beach,1.0
7053,NJ: SECAUCUS POLICE DEPARTMENT,0.0,0.0,NJ: Secaucus,1.0
7054,CA: MODESTO POLICE DEPARTMENT,0.0,0.0,CA: Modesto,8.0
7062,DE: DELAWARE STATE POLICE,0.0,0.0,DE: Lewes,1.0
7082,MO: PITTSBURG POLICE DEPARTMENT,0.0,0.0,MO: South West Township,1.0
7083,OH: MANSFIELD POLICE DEPARTMENT,0.0,0.0,OH: Mansfield,5.0
7088,MD: BALTIMORE COUNTY POLICE DEPARTMENT,0.0,0.0,MD: Parkton,26.0
7114,SC: CHESTER POLICE DEPARTMENT,0.0,0.0,SC: Chester,1.0
7116,GA: HAMPTON POLICE DEPARTMENT,0.0,0.0,GA: Hampton,2.0
7118,CA: U.S. DRUG ENFORCEMENT ADMINISTRATION,0.0,0.0,CA: Los Angeles,1.0
7119,NV: HENDERSON POLICE DEPARTMENT,0.0,0.0,NV: Henderson,7.0
7126,MS: HORN LAKE POLICE DEPARTMENT,0.0,0.0,MS: Horn Lake,2.0
7128,OH: CLEVELAND DIVISION OF POLICE,0.0,0.0,OH: Cleveland,10.0
7138,MA: WESTBOROUGH POLICE DEPARTMENT,0.0,0.0,MA: Westborough,1.0
7139,NC: CHARLOTTE-MECKLENBURG POLICE DEPARTMENT,0.0,0.0,NC: Charlotte,21.0
7160,WA: EVERETT POLICE DEPARTMENT,0.0,0.0,WA: Everett,1.0
7161,NC: NORTH CAROLINA DEPARTMENT OF MOTOR VEHICLES,0.0,0.0,NC: Wilson,1.0
7162,CA: RICHMOND POLICE DEPARTMENT,0.0,0.0,CA: Vallejo,1.0
7166,FL: MANNFORD POLICE DEPARTMENT,0.0,0.0,FL: Pensacola Beach,1.0
7167,OK: CHEROKEE NATION MARSHAL SERVICE,0.0,0.0,OK: Tahlequah,2.0
7169,OK: U.S. MARSHALS SERVICE,0.0,0.0,OK: Henryetta,3.0
7172,WI: TWO RIVERS POLICE DEPARTMENT,0.0,0.0,WI: Two Rivers,1.0
7173,NM: U.S. BORDER PATROL,0.0,0.0,NM: Sunland Park,2.0
7175,NM: NEW MEXICO STATE POLICE,0.0,0.0,NM: Alamogordo,1.0
7211,CA: CALIFORNIA HIGHWAY PATROL,0.0,0.0,CA: Fresno,5.0
7279,MD: BALTIMORE POLICE DEPARTMENT,0.0,0.0,MD: Baltimore,31.0
7310,GA: ATHENS-CLARKE COUNTY POLICE DEPARTMENT,0.0,0.0,GA: Athens,4.0
7314,NY: NEW YORK POLICE DEPARTMENT,0.0,0.0,NY: Brooklyn,75.0
7389,NC: GREENVILLE POLICE DEPARTMENT,0.0,0.0,NC: Greenville,7.0
7396,OR: ALBANY POLICE DEPARTMENT,0.0,0.0,OR: Albany,1.0
7397,CA: LONG BEACH POLICE DEPARTMENT,0.0,0.0,CA: Long Beach,24.0
7421,CA: LOS ANGELES COUNTY PROBATION DEPARTMENT,0.0,0.0,CA: Carson,1.0
7422,OH: OHIO STATE HIGHWAY PATROL,0.0,0.0,OH: Dayton,1.0
7428,OR: HILLSBORO POLICE DEPARTMENT,0.0,0.0,OR: Hillsboro,5.0
7433,CO: DENVER POLICE DEPARTMENT,0.0,0.0,CO: Denver,30.0
7463,ID: BOISE POLICE DEPARTMENT,0.0,0.0,ID: Boise,1.0
7475,TX: TEXAS DEPARTMENT OF PUBLIC SAFETY,0.0,0.0,TX: Palestine,7.0
7523,NJ: HOWELL POLICE DEPARTMENT,0.0,0.0,NJ: Farmingdale,1.0
7524,MI: BRISTOL (INDIANA) POLICE DEPARTMENT,0.0,0.0,MI: White Pigeon,1.0
7525,AR: ARKANSAS STATE POLICE,0.0,0.0,AR: Warren,2.0
7541,OR: OAKRIDGE POLICE DEPARTMENT,0.0,0.0,OR: Oakridge,1.0
7542,VA: ROANOKE POLICE DEPARTMENT,0.0,0.0,VA: Roanoke,1.0
7543,GA: DEKALB COUNTY POLICE DEPARTMENT,0.0,0.0,GA: Stone Mountain,13.0
7571,GA: ATHENS POLICE DEPARTMENT,0.0,0.0,GA: Athens,1.0
7572,TX: CORPUS CHRISTI POLICE DEPARTMENT,0.0,0.0,TX: Corpus Christi,7.0
7579,AR: ARKANSAS DEPARTMENT OF CORRECTIONS,0.0,0.0,AR: Pine Bluff,1.0
7580,FL: FLORIDA DEPARTMENT OF LAW ENFORCEMENT,0.0,0.0,FL: North Port,1.0
7581,CA: U.S. MARSHALS SERVICE,0.0,0.0,CA: Lancaster,2.0
7583,NM: FARMINGTON POLICE DEPARTMENT,0.0,0.0,NM: Farmington,5.0
7588,OR: ST. HELENS POLICE DEPARTMENT,0.0,0.0,OR: Deer Island,1.0
7589,NE: BURLINGTON NORTHERN SANTA FE RAILWAY POLICE DEPARTMENT,0.0,0.0,NE: Lincoln,1.0
7590,UT: U.S. MARSHAL SERVICE,0.0,0.0,UT: Layton,1.0
7591,MO: MARYLAND HEIGHTS POLICE DEPARTMENT,0.0,0.0,MO: Maryland Heights,1.0
7592,TX: CARROLLTON POLICE DEPARTMENT,0.0,0.0,TX: Carrollton,3.0
7595,IL: BRIDGEVIEW POLICE DEPARTMENT,0.0,0.0,IL: Palos Hills,1.0
7596,GA: GAINESVILLE POLICE DEPARTMENT,0.0,0.0,GA: Gainesville,3.0
7599,MA: BOSTON POLICE DEPARTMENT,0.0,0.0,MA: Boston,12.0
7611,FL: MIAMI-DADE POLICE DEPARTMENT,0.0,0.0,FL: Miami,1.0
7701,CA: LA HABRA POLICE DEPARTMENT,0.0,0.0,CA: La Habra,1.0
7702,TX: DALLAS POLICE DEPARTMENT,0.0,0.0,TX: Dallas,40.0
7742,NC: SANFORD POLICE DEPARTMENT,0.0,0.0,NC: Sanford,3.0
7745,WV: HUNTINGTON POLICE DEPARTMENT,0.0,0.0,WV: Huntington,2.0
7747,WY: RIVERTON POLICE DEPARTMENT,0.0,0.0,WY: Riverton,2.0
7749,TN: SODDY-DAISY POLICE DEPARTMENT,0.0,0.0,TN: Soddy-Daisy,1.0
7750,MS: SHANNON POLICE DEPARTMENT,0.0,0.0,MS: Shannon,2.0
7752,PA: PITTSBURGH BUREAU OF POLICE,0.0,0.0,PA: Pittsburgh,7.0
7759,VA: HENRICO COUNTY DIVISION OF POLICE,0.0,0.0,VA: Richmond,1.0
7760,FL: MILTON POLICE DEPARTMENT,0.0,0.0,FL: Milton,1.0
7761,DC: DC METROPOLITAN POLICE DEPARTMENT,0.0,0.0,DC: Washington,19.0
7780,MN: ST. PAUL POLICE DEPARTMENT,0.0,0.0,MN: St. Paul,13.0
7793,TX: ARLINGTON POLICE DEPARTMENT,0.0,0.0,TX: Arlington,14.0
7807,TX: U.S. CUSTOMS AND BORDER PROTECTION,0.0,0.0,TX: Brackettville,1.0
7808,IA: BURLINGTON POLICE DEPARTMENT,0.0,0.0,IA: Burlington,3.0
7811,OH: COLUMBUS DIVISION OF POLICE,0.0,0.0,OH: Columbus,40.0
7851,UT: WELLINGTON POLICE DEPARTMENT,0.0,0.0,UT: Wellington,1.0
7852,WA: TACOMA POLICE DEPARTMENT,0.0,0.0,WA: Tacoma,9.0
7861,NV: LAS VEGAS METROPOLITAN POLICE DEPARTMENT,0.0,0.0,NV: Las Vegas,59.0
7920,WI: FOX VALLEY METRO POLICE DEPARTMENT,0.0,0.0,WI: Kaukauna,1.0
7921,MT: MISSOULA POLICE DEPARTMENT,0.0,0.0,MT: Missoula,2.0
7923,TX: KERRVILLE POLICE DEPARTMENT,0.0,0.0,TX: Kerrville,2.0
7925,MN: BROOKLYN CENTER POLICE DEPARTMENT,0.0,0.0,MN: Brooklyn Center,1.0
7929,MO: RICHMOND HEIGHTS POLICE DEPARTMENT,0.0,0.0,MO: Clayton,1.0
7930,DE: WILMINGTON POLICE DEPARTMENT,0.0,0.0,DE: Wilmington,4.0
7934,MO: OVERLAND POLICE DEPARTMENT,0.0,0.0,MO: Overland,1.0
7935,UT: WEST VALLEY CITY POLICE DEPARTMENT,0.0,0.0,UT: West Valley City,2.0
7937,OH: DAYTON POLICE DEPARTMENT,0.0,0.0,OH: Dayton,6.0
7943,NY: ELMIRA POLICE DEPARTMENT,0.0,0.0,NY: Elmira,2.0
7945,KY: KENTUCKY STATE POLICE,0.0,0.0,KY: Nicholasville,4.0
7999,CA: BUENA PARK POLICE DEPARTMENT,0.0,0.0,CA: Fullerton,1.0
8000,WI: CALEDONIA POLICE DEPARTMENT,0.0,0.0,WI: Racine,1.0
8001,UT: OGDEN POLICE DEPARTMENT,0.0,0.0,UT: Ogden,8.0
8009,AL: LINCOLN POLICE DEPARTMENT,0.0,0.0,AL: Talladega,1.0
8010,KS: CHETOPA POLICE DEPARTMENT,0.0,0.0,KS: Chetopa,1.0
8011,MS: TIPPAH COUNTY CONSTABLE,0.0,0.0,MS: Ripley,1.0
8012,CA: BEAUMONT POLICE DEPARTMENT,0.0,0.0,CA: Beaumont,3.0
8015,VT: MONTPELIER POLICE DEPARTMENT,0.0,0.0,VT: Montpelier,1.0
8017,TX: GARLAND POLICE DEPARTMENT,0.0,0.0,TX: Garland,1.0
8031,NJ: IRVINGTON POLICE DEPARTMENT,0.0,0.0,NJ: Irvington,2.0
8033,MS: MOSS POINT POLICE DEPARTMENT,0.0,0.0,MS: Moss Point,2.0
8035,IA: COUNCIL BLUFFS POLICE DEPARTMENT,0.0,0.0,IA: Council Bluffs,1.0
8036,PA: ALLEGHENY COUNTY POLICE DEPARTMENT,0.0,0.0,PA: Glenshaw,1.0
8038,OR: OREGON STATE POLICE,0.0,0.0,OR: Grants Pass,4.0
8058,CO: RIFLE POLICE DEPARTMENT,0.0,0.0,CO: Rifle,1.0
8059,GA: BRASELTON POLICE DEPARTMENT,0.0,0.0,GA: Loganville,1.0
8060,IN: INDIANAPOLIS METROPOLITAN POLICE DEPARTMENT,0.0,0.0,IN: Indianapolis,26.0
8086,PA: ALLENTOWN POLICE DEPARTMENT,0.0,0.0,PA: Allentown,3.0
8089,TN: CHATTANOOGA POLICE DEPARTMENT,0.0,0.0,TN: Chattanooga,5.0
8094,PA: ROARING SPRING POLICE DEPARTMENT,0.0,0.0,PA: Roaring Spring,1.0
8095,TX: U.S. FEDERAL BUREAU OF INVESTIGATION,0.0,0.0,TX: Robinson,1.0
8099,PA: BUREAU OF NARCOTICS INVESTIGATIONS OF THE OFFICE OF ATTORNEY GENERAL,0.0,0.0,PA: Pittsburgh,1.0
